ID_Produktu;Nazwa_Produktu;Poczatkowa_Sciezka_OLX;Finalna_Sciezka_AI;Finalne_ID_AI;Czy_Zmieniono_Kategorie;Ocena_Pewnosci_AI;Uzasadnienie_AI
242636945;Ściereczka na rolce 26,5x32cm Perfecto biała 1 rol;Dom i Ogród > Wyposażenie wnętrz > Przybory kuchenne > Ścierki, rękawice i fartuchy;Dom i Ogród > Wyposażenie wnętrz > Przybory kuchenne > Ścierki, rękawice i fartuchy;2131;Kategoria nie została zmieniona;100%;Produkt to ściereczki kuchenne na rolce, co bezpośrednio odpowiada kategorii 'Ścierki, rękawice i fartuchy' umiejscowionej w przyborach kuchennych.
242636948;Ściereczka duża 40x50cm Perfecto kolor mix 3szt;Dla Dzieci > Artykuły szkolne > Artykuły papiernicze > Pozostałe Artykuły papiernicze;Dom i Ogród > Wyposażenie wnętrz > Przybory kuchenne > Ścierki, rękawice i fartuchy;2131;TAK;100%;Produkt to zestaw ściereczek do czyszczenia powierzchni, co idealnie pasuje do kategorii 'Ścierki, rękawice i fartuchy' znajdującej się w sekcji Przybory kuchenne.
242636952;Ściereczka na rolce Fala żółta ZPW 25szt.;Dom i Ogród > Wyposażenie wnętrz > Przybory kuchenne > Ścierki, rękawice i fartuchy;Dom i Ogród > Wyposażenie wnętrz > Przybory kuchenne > Ścierki, rękawice i fartuchy;2131;Kategoria nie została zmieniona;100%;Produkt to ściereczka do użytku domowego (kuchennego). Najbardziej precyzyjną kategorią w drzewie jest ID 2131: 'Ścierki, rękawice i fartuchy' znajdująca się w sekcji 'Przybory kuchenne'.
242636953;Ściereczka na rolce Fala zielona ZPW 25szt.;Dom i Ogród > Wyposażenie wnętrz > Przybory kuchenne > Ścierki, rękawice i fartuchy;Dom i Ogród > Wyposażenie wnętrz > Przybory kuchenne > Ścierki, rękawice i fartuchy;2131;Kategoria nie została zmieniona;100%;Produkt to ściereczki czyszczące (rolka ścierek) przeznaczone do gospodarstw domowych, co bezpośrednio odpowiada nazwie kategorii 'Ścierki, rękawice i fartuchy' znajdującej się w przyborach kuchennych.
242636955;Ściereczka na rolce Fala różowa ZPW 25szt.;Dom i Ogród > Wyposażenie wnętrz > Przybory kuchenne > Ścierki, rękawice i fartuchy;Dom i Ogród > Wyposażenie wnętrz > Przybory kuchenne > Ścierki, rękawice i fartuchy;2131;Kategoria nie została zmieniona;100%;Produkt to zestaw ściereczek do użytku domowego, co precyzyjnie odpowiada specyfice kategorii 'Ścierki, rękawice i fartuchy' znajdującej się w przyborach kuchennych w dziale Dom i Ogród.
242636958;Brokat Dekoracyjny 5 Gram Złoty Azucren;Dla Dzieci > Artykuły szkolne > Artykuły plastyczne > Pozostałe Artykuły plastyczne;Dla Dzieci > Artykuły szkolne > Artykuły plastyczne > Pozostałe Artykuły plastyczne;4629;Kategoria nie została zmieniona;95%;Produkt to brokat sypki, który jest podstawowym materiałem do prac plastycznych, kreatywnych i rękodzielniczych. Kategoria 'Pozostałe Artykuły plastyczne' w sekcji 'Dla Dzieci' jest najbardziej odpowiednia dla tego typu akcesoriów hobbystycznych i szkolnych.
242636960;Plecak worek szkolny do przedszkola Dinozaury;Dla Dzieci > Artykuły szkolne > Plecaki szkolne;Dla Dzieci > Artykuły szkolne > Plecaki szkolne;4605;Kategoria nie została zmieniona;95%;Produkt jest wprost nazwany plecakiem workiem szkolnym do przedszkola. Kategoria 'Plecaki szkolne' (id: 4605) w sekcji 'Artykuły szkolne' jest najbardziej precyzyjnym dopasowaniem dla tego typu akcesorium dziecięcego.
242636961;Torba papierowa z uchem 32x16x42cm 250szt;Dla Dzieci > Artykuły szkolne > Artykuły papiernicze > Pozostałe Artykuły papiernicze;Firma i Przemysł > Sklepy i magazyny > Pozostałe;4681;TAK;95%;Produkt to hurtowa ilość (250 sztuk) jednorazowych toreb papierowych przeznaczonych do celów handlowych, reklamowych i cateringowych. Najlepiej pasuje do kategorii Firma i Przemysł > Sklepy i magazyny > Pozostałe, która obejmuje artykuły eksploatacyjne dla punktów sprzedaży.
242636967;Próbnik Tester Napięcia Bezdotykowy 12-1000V;Dom i Ogród > Narzędzia > Przyrządy miernicze;Praca > IT / telekomunikacja > Tester;1717;TAK;100%;Produkt to bezdotykowy próbnik napięcia (tester elektryczny), który jest klasycznym przyrządem mierniczym wykorzystywanym w pracach domowych oraz profesjonalnych instalacjach elektrycznych.
242636968;Pojemnik 4-warstwy na żywność/mleko w proszku 2szt;Dom i Ogród > Wyposażenie wnętrz > Przybory kuchenne > Pojemniki i przechowywanie żywności;Dla Dzieci > Akcesoria dla niemowląt > Akcesoria do karmienia;4748;TAK;95%;Produkt jest dozownikiem do mleka w proszku i pojemnikiem na żywność dla niemowląt, co jednoznacznie klasyfikuje go jako akcesorium do karmienia w kategorii Dla Dzieci.
242636970;Topper Tęcza Dekoracja Tortu Urodzinowego Ozdoba;Dom i Ogród > Wyposażenie wnętrz > Ozdoby okolicznościowe;Dom i Ogród > Wyposażenie wnętrz > Ozdoby okolicznościowe;2111;Kategoria nie została zmieniona;100%;Produkt to topper na tort, który jest typową dekoracją używaną podczas imprez (urodziny, wesela). Kategoria 'Ozdoby okolicznościowe' (ID 2111) w sekcji wyposażenia wnętrz jest dla tego typu przedmiotów najbardziej precyzyjnym wyborem.
242636971;Topper Chmura Papierowa Dekoracja Tortu Babeczek;Dom i Ogród > Wyposażenie wnętrz > Przybory kuchenne > Akcesoria cukiernicze;Dom i Ogród > Wyposażenie wnętrz > Przybory kuchenne > Akcesoria cukiernicze;2115;Kategoria nie została zmieniona;100%;Produkt jest topperem (dekoracją) przeznaczoną do ozdabiania tortów i wypieków, co jednoznacznie klasyfikuje go jako akcesorium cukiernicze w dziale przyborów kuchennych.
242636976;Szczotka Do Butelek Silikonowa Zestaw 2Szt;Zdrowie i Uroda > Włosy > Stylizacja > Szczotki i grzebienie;Dla Dzieci > Akcesoria dla niemowląt > Akcesoria do karmienia;4748;TAK;95%;Produkt to zestaw szczotek przeznaczonych do mycia butelek, a opis wyraźnie wskazuje na ich idealne zastosowanie do butelek dla niemowląt. W strukturze OLX szczotki do butelek niemowlęcych są przypisane do kategorii Akcesoria do karmienia w dziale Dla Dzieci.
242636978;Topper Dekoracje Tortu Róż-Fioletet Motyle 80Szt;Dom i Ogród > Wyposażenie wnętrz > Przybory kuchenne > Akcesoria cukiernicze;Dom i Ogród > Wyposażenie wnętrz > Przybory kuchenne > Akcesoria cukiernicze;2115;Kategoria nie została zmieniona;100%;Produkt to zestaw dekoracji cukierniczych (toppery na tort), które jednoznacznie pasują do kategorii akcesoriów cukierniczych w dziale wyposażenia kuchni.
242636979;Kalendarz Adwentowy Do Zawieszenia Dekorowania Diy;Dla Dzieci > Artykuły szkolne > Artykuły papiernicze > Pozostałe Artykuły papiernicze;Dom i Ogród > Wyposażenie wnętrz > Ozdoby okolicznościowe;2111;TAK;95%;Kalendarz adwentowy jest produktem sezonowym, który pełni funkcję dekoracji ściennej na Boże Narodzenie. W drzewie kategorii OLX, przedmioty dekoracyjne związane ze świętami oraz kalendarze adwentowe są klasyfikowane jako 'Ozdoby okolicznościowe' w sekcji 'Wyposażenie wnętrz'. Mimo dołączonych pisaków i charakteru DIY, głównym przeznaczeniem produktu jest dekoracja wnętrza i odliczanie dni do świąt.
242636985;Pudełko Uchwyt Na Szczoteczki Do Zębów;Zdrowie i Uroda > Higiena jamy ustnej > Szczoteczki;Dom i Ogród > Wyposażenie wnętrz > Akcesoria łazienkowe > Kubki i pojemniki łazienkowe;2049;TAK;95%;Produkt to uchwyt i pojemnik ścienny przeznaczony do organizacji akcesoriów łazienkowych, takich jak szczoteczki i pasta. Najbardziej precyzyjną kategorią dla tego typu elementów wyposażenia łazienki jest 'Kubki i pojemniki łazienkowe'.
242636986;Bateria kuchenna wymienna;Brak;Dom i Ogród > Wykończenie wnętrz > Kuchnia > Baterie kuchenne;3228;TAK;95%;Produkt jest zamienną głowicą (wylewką) do baterii kuchennej. Najbardziej dopasowaną kategorią końcową dla armatury kuchennej i jej bezpośrednich podzespołów jest 'Baterie kuchenne'.
242636988;Dekoracja Świąteczna Drewniana Na Choinkę 24Szt;Dom i Ogród > Wyposażenie wnętrz > Ozdoby okolicznościowe;Dom i Ogród > Wyposażenie wnętrz > Ozdoby okolicznościowe;2111;Kategoria nie została zmieniona;100%;Produkt to zestaw 24 drewnianych ozdób choinkowych, które są typowymi dekoracjami świątecznymi. Kategoria 'Ozdoby okolicznościowe' (pod Wyposażeniem wnętrz) jest najbardziej precyzyjnym miejscem dla tego typu artykułów dekoracyjnych związanych z Bożym Narodzeniem.
242637021;Gąbka Ścierna Kostka Dwustronna Szlifierska 150;Dom i Ogród > Narzędzia > Elektronarzędzia > Szlifierki;Dom i Ogród > Narzędzia > Elektronarzędzia;1691;TAK;95%;Produkt to gąbka ścierna do ręcznego szlifowania, co kwalifikuje go bezpośrednio do kategorii narzędzi ręcznych. Wybrana kategoria jest bardziej adekwatna niż sugerowane przez system elektronarzędzia, ponieważ przedmiot nie posiada napędu elektrycznego.
242637037;Poszewka dekoracyjna na poduszkę Rower 50x30cm;Dom i Ogród > Wyposażenie wnętrz > Pościel > Poszewki;Dom i Ogród > Wyposażenie wnętrz > Pościel > Poszewki;2041;Kategoria nie została zmieniona;100%;Produkt to poszewka dekoracyjna, co wprost odpowiada kategorii liściowej 'Poszewki' (ID: 2041) w sekcji Wyposażenie wnętrz > Pościel.
242637038;Pazury do mięsa rozdrabniacz do grilla 2szt;Dom i Ogród > Ogród > Grill;Dom i Ogród > Ogród > Grill;1633;Kategoria nie została zmieniona;95%;Produkt to specjalistyczne akcesorium do rozdrabniania mięsa (szarpana wieprzowina itp.), które jest bezpośrednio dedykowane do użytku podczas grillowania, co czyni kategorię Grill najbardziej trafną.
242637040;Nożyczki do paznokci brwi 2 sztuki Stal nierdzewna;Zdrowie i Uroda > Paznokcie > Akcesoria > Pozostałe;Zdrowie i Uroda > Paznokcie > Akcesoria > Nożyczki;3771;TAK;100%;Produkt to nożyczki przeznaczone do manicure i pielęgnacji, dla których w drzewie kategorii OLX istnieje precyzyjna kategoria liściasta 'Nożyczki' w sekcji Zdrowie i Uroda > Paznokcie > Akcesoria.
242637042;Zestaw nożyczek do paznokci i szczoteczki do brwi;Zdrowie i Uroda > Twarz > Pielęgnacja > Zestawy kosmetyków;Zdrowie i Uroda > Paznokcie > Akcesoria > Nożyczki;3771;TAK;95%;Głównym elementem produktu są nożyczki do paznokci (manicure) wykonane ze stali nierdzewnej. W drzewie kategorii OLX najbardziej precyzyjnym liściem dla tego narzędzia jest kategoria 'Nożyczki' znajdująca się w sekcji Zdrowie i Uroda > Paznokcie > Akcesoria.
242637043;Uchwyt organizer na kable samoprzylepny 6szt;Elektronika > Telefony > Akcesoria > Uchwyty;Dom i Ogród > Wyposażenie wnętrz > Przybory kuchenne > Pozostałe;2127;TAK;85%;Produkt jest organizerem do kabli, a opis wyraźnie sugeruje jego przeznaczenie do małych urządzeń kuchennych (miksery, blaty kuchenne). W związku z tym najlepiej pasuje do kategorii gadżetów kuchennych: Dom i Ogród > Wyposażenie wnętrz > Przybory kuchenne > Pozostałe.
242637046;Pistolety na wode 2 sztuki czerowny i niebieski;Dla Dzieci > Zabawki > Pozostałe;Dla Dzieci > Zabawki > Pozostałe;3093;Kategoria nie została zmieniona;95%;Produkt to pistolety na wodę, które są typowymi zabawkami dla dzieci. W drzewie kategorii pod węzłem Zabawki (231) brakuje specyficznej podkategorii dla zabawek ogrodowych, letnich lub wodnych, dlatego kategoria Pozostałe (3093) jest najbardziej trafnym i najgłębszym możliwym wyborem.
242637049;Skrobak do ciasta 2 szt i foremki do ciastek 8szt;Dom i Ogród > Wyposażenie wnętrz > Przybory kuchenne > Blachy i formy do pieczenia;Dom i Ogród > Wyposażenie wnętrz > Przybory kuchenne > Akcesoria cukiernicze;2115;TAK;100%;Produkt składa się ze skrobaków do ciasta oraz foremek do ciastek, które są klasyfikowane jako akcesoria cukiernicze służące do przygotowywania i dekorowania wypieków.
242637051;Płaszcz przeciwdeszczowy długi ponczo białe 3szt;Moda > Ubrania damskie > Odzież wierzchnia > Płaszcze;Moda > Ubrania damskie > Odzież wierzchnia > Kurtki przeciwdeszczowe;2561;TAK;95%;Produkt to odzież wierzchnia o specyficznym przeznaczeniu (ochrona przed deszczem). Najbardziej precyzyjną kategorią dla ponczo przeciwdeszczowego z materiału EVA jest kategoria 'Kurtki przeciwdeszczowe'. Ponieważ produkt jest unisex, a platforma nie posiada takiej kategorii, wybrano sekcję damską jako najczęstsze miejsce docelowe dla tego typu akcesoriów.
242637052;Mini wentylator kieszonkowy wiatraczek Fiolet;Elektronika > Sprzęt AGD > AGD drobne > Klimatyzacja i wentylacja;Elektronika > Sprzęt AGD > AGD drobne > Klimatyzacja i wentylacja;2231;Kategoria nie została zmieniona;100%;Produkt to przenośny wentylator (wiatraczek) na baterię, co jednoznacznie klasyfikuje go w kategorii drobnego sprzętu AGD służącego do wentylacji.
242637055;Mini wentylator kieszonkowy wiatraczek Beżowy;Elektronika > Sprzęt AGD > AGD drobne > Klimatyzacja i wentylacja;Elektronika > Sprzęt AGD > AGD drobne > Klimatyzacja i wentylacja;2231;Kategoria nie została zmieniona;100%;Produkt to przenośny wentylator ręczny (wiatraczek), który jest urządzeniem elektrycznym służącym do wymuszania przepływu powietrza. Najbardziej precyzyjną kategorią w drzewie OLX dla tego typu drobnych urządzeń chłodzących jest 'Klimatyzacja i wentylacja' w sekcji AGD drobne.
242637056;Mini wentylator kieszonkowy wiatraczek Czerwony;Elektronika > Sprzęt AGD > AGD drobne > Klimatyzacja i wentylacja;Elektronika > Sprzęt AGD > AGD drobne > Klimatyzacja i wentylacja;2231;Kategoria nie została zmieniona;100%;Produkt to mini wentylator (wiatraczek), który jest małym urządzeniem elektrycznym służącym do wymuszania ruchu powietrza i chłodzenia, co idealnie pasuje do kategorii Klimatyzacja i wentylacja w sekcji AGD drobne.
242637057;Poszewki dekoracyjne świąteczne boże narodzenie 6s;Dom i Ogród > Wyposażenie wnętrz > Pościel > Poszewki;Dom i Ogród > Wyposażenie wnętrz > Pościel > Poszewki;2041;Kategoria nie została zmieniona;98%;Produkt to zestaw poszewek na poduszki (jasiek 45x45 cm). Kategoria 'Poszewki' (ID 2041) w sekcji 'Wyposażenie wnętrz > Pościel' jest najbardziej precyzyjnym określeniem typu tego przedmiotu w dostępnym drzewie kategorii.
242637060;Organizer na łóżeczko dziecięce torebeczka tęcza;Dla Dzieci > Akcesoria dla niemowląt > Torby, plecaki, organizery;Dla Dzieci > Akcesoria dla niemowląt > Torby, plecaki, organizery;4763;Kategoria nie została zmieniona;100%;Produkt to lniany organizer na łóżeczko dziecięce, co bezpośrednio odpowiada kategorii 'Torby, plecaki, organizery' znajdującej się w sekcji akcesoriów dla niemowląt.
242637061;Rękaw cukierniczy foliowy 100sztuk;Dom i Ogród > Wyposażenie wnętrz > Przybory kuchenne > Akcesoria cukiernicze;Dom i Ogród > Wyposażenie wnętrz > Przybory kuchenne > Akcesoria cukiernicze;2115;Kategoria nie została zmieniona;100%;Produkt to jednorazowe rękawy cukiernicze służące do dekoracji wypieków, co jednoznacznie klasyfikuje go w kategorii Akcesoria cukiernicze będącej liściem w ścieżce Dom i Ogród > Wyposażenie wnętrz > Przybory kuchenne.
242637062;Farby akryloe na bazie miodu 24kolory Premium;Dla Dzieci > Artykuły szkolne > Artykuły plastyczne > Farby;Dla Dzieci > Artykuły szkolne > Artykuły plastyczne > Farby;4610;Kategoria nie została zmieniona;95%;Produkt to zestaw farb (akwareli) marki KreativKids, przeznaczony dla dzieci powyżej 3 roku życia oraz hobbystów, co idealnie wpisuje się w kategorię Farby w sekcji Artykułów plastycznych dla dzieci.
242637065;Diamentowy Haft Mozaika DIY Plaża 35x45cm;Dla Dzieci > Zabawki > Zabawki edukacyjne;Dla Dzieci > Zabawki > Zabawki plastyczne;3084;TAK;95%;Produkt to zestaw do haftu diamentowego (DIY), który jest formą kreatywnej aktywności plastycznej. W strukturze kategorii OLX zestawy do samodzielnego tworzenia dzieł artystycznych, mozaiki i robótki ręczne są najdokładniej klasyfikowane jako 'Zabawki plastyczne' w sekcji 'Dla Dzieci'.
242637066;Zestaw Narzędzi ogrodniczych 3 szt stal nierdzewna;Dom i Ogród > Narzędzia > Narzędzia ręczne;Dom i Ogród > Ogród > Narzędzia ogrodowe > Pozostałe;2886;TAK;95%;Produkt to zestaw ręcznych narzędzi przeznaczonych wyłącznie do prac w ogrodzie (widełki, łopatka, chwastownik). Zgodnie z drzewem kategorii, najbardziej trafnym wyborem jest ścieżka Dom i Ogród > Ogród > Narzędzia ogrodowe. Ponieważ zestaw nie pasuje do żadnego ze specyficznych liści w tej sekcji (takich jak grabie czy siewniki), wybieram kategorię 'Pozostałe' (ID 2886) w obrębie narzędzi ogrodowych.
242637071;Fartuch Kuchenny z Kieszeniami 2szt Granatowy;Dom i Ogród > Wyposażenie wnętrz > Przybory kuchenne > Ścierki, rękawice i fartuchy;Dom i Ogród > Wyposażenie wnętrz > Przybory kuchenne > Ścierki, rękawice i fartuchy;2131;Kategoria nie została zmieniona;100%;Produkt to fartuch kuchenny przeznaczony do użytku domowego, co jednoznacznie odpowiada kategorii 'Ścierki, rękawice i fartuchy' w sekcji przyborów kuchennych.
242637072;Ściereczki do Czyszczenia Ekranu sucho mokro 8szt;Dom i Ogród > Supermarket > Środki czyszczące;Elektronika > Telefony > Akcesoria > Pozostałe;2917;TAK;95%;Produkt to specjalistyczny zestaw ściereczek do czyszczenia ekranów urządzeń mobilnych (telefony, tablety), najczęściej stosowany przed montażem szkieł hartowanych. Ze względu na przeznaczenie produktu do konkretnych urządzeń elektronicznych, najlepiej pasuje on do kategorii akcesoriów telefonicznych (Elektronika > Telefony > Akcesoria > Pozostałe).
242637073;Kanister Zbiornik baniak składany z uchwytem 10l;Dom i Ogród > Narzędzia > Narzędzia ręczne;Sport i Hobby > Turystyka > Kuchnie i meble turystyczne > Naczynia i sztućce turystyczne;3997;TAK;90%;Produkt to składany kanister na wodę o charakterze turystycznym i biwakowym, przeznaczony do przechowywania wody pitnej podczas wyjazdów. Najlepiej pasuje do kategorii naczyń i sztućców turystycznych w sekcji Turystyka.
242637076;Chwyty Rowerowe Gripy Silikonowe Niebieskie;Sport i Hobby > Rowery > Akcesoria rowerowe > Uchwyty rowerowe;Sport i Hobby > Rowery > Akcesoria rowerowe > Uchwyty rowerowe;4233;Kategoria nie została zmieniona;100%;Produkt to silikonowe chwyty (gripy) do kierownicy rowerowej, co bezpośrednio odpowiada kategorii liściastej 'Uchwyty rowerowe' (id: 4233) w sekcji akcesoriów rowerowych.
242637077;Komplet misek ceramicznych do ramenu dla 2 os.;Dom i Ogród > Wyposażenie wnętrz > Zastawa stołowa > Miski;Brak ID od AI;Brak;NIE;0%;Błąd parsowania odpowiedzi JSON od LLM.
242637080;Klipsy spinki do włosów pazur 3 sztuki;Moda > Akcesoria > Akcesoria do włosów > Spinki i wsuwki;Moda > Akcesoria > Akcesoria do włosów > Spinki i wsuwki;2731;Kategoria nie została zmieniona;100%;Produkt to spinki do włosów typu 'szczęka' (pazur), co bezpośrednio odpowiada kategorii 'Spinki i wsuwki' znajdującej się w akcesoriach do włosów w dziale Moda.
242637083;Pop Up kartka z życzeniami różowe lilie 3D;Dla Dzieci > Artykuły szkolne > Artykuły papiernicze > Karteczki;Dom i Ogród > Wyposażenie wnętrz > Ozdoby okolicznościowe;2111;TAK;95%;Kartka z życzeniami 3D (Pop Up) najlepiej pasuje do kategorii 'Ozdoby okolicznościowe', ponieważ jest to przedmiot dekoracyjny przeznaczony na konkretne okazje (urodziny, ślub, święta), co jest zgodne z przeznaczeniem tej sekcji w dziale Wyposażenie wnętrz.
242637088;Rękawice nitrylowe niebies 5-6 XS Medasept 100szt;Firma i Przemysł > Odzież robocza > Rękawice;Firma i Przemysł > Odzież robocza > Rękawice;4279;Kategoria nie została zmieniona;95%;Produkt to rękawice nitrylowe ochronne sprzedawane w opakowaniu zbiorczym (100 sztuk), przeznaczone do użytku profesjonalnego w wielu branżach (gastronomia, przemysł, kosmetyka). Kategoria 'Rękawice' w sekcji 'Odzież robocza' w dziale 'Firma i Przemysł' jest najbardziej adekwatna dla materiałów eksploatacyjnych ochrony osobistej o takim zastosowaniu.
242637093;Rękawice nitrylowe różowe 9 L Medasept 100szt;Firma i Przemysł > Odzież robocza > Rękawice;Zdrowie i Uroda > Środki ochrony > Rękawiczki;3724;TAK;95%;Produkt jest sklasyfikowany jako wyrób medyczny o przeznaczeniu diagnostycznym i ochronnym. Opis wyraźnie wskazuje na zastosowania medyczne, stomatologiczne oraz kosmetyczne, co najlepiej odpowiada kategorii Zdrowie i Uroda > Środki ochrony > Rękawiczki.
242637096;Haft Diamentowy z Motywem Motyla 5D 2szt;Dla Dzieci > Zabawki > Zabawki plastyczne;Dla Dzieci > Zabawki > Zabawki plastyczne;3084;Kategoria nie została zmieniona;95%;Haft diamentowy to zestaw kreatywny DIY służący do tworzenia dekoracji. Zgodnie ze specyfiką drzewa kategorii OLX i powszechną praktyką kategoryzacji tego typu produktów, najlepiej pasuje on do kategorii 'Zabawki plastyczne', która obejmuje wszelkiego rodzaju zestawy do prac ręcznych i twórczych, niezależnie od grupy wiekowej.
242637099;Organizer Do Szuflady Szafy 4Szt;Dom i Ogród > Wyposażenie wnętrz > Pudełka;Dom i Ogród > Wyposażenie wnętrz > Pudełka;2102;Kategoria nie została zmieniona;95%;Produkt to zestaw tekstylnych organizerów (pudełek z przegródkami) przeznaczonych do porządkowania wnętrza szaf i szuflad, co idealnie wpisuje się w definicję kategorii Pudełka w sekcji Wyposażenie wnętrz.
242637100;Kubek ceramiczny do łazienki na szczoteczki pędzle;Dom i Ogród > Wyposażenie wnętrz > Akcesoria łazienkowe > Zestawy akcesoriów;Dom i Ogród > Wyposażenie wnętrz > Akcesoria łazienkowe > Kubki i pojemniki łazienkowe;2049;TAK;100%;Produkt to ceramiczny kubek łazienkowy, który idealnie pasuje do najbardziej szczegółowej kategorii 'Kubki i pojemniki łazienkowe'.
242637104;Szczotka Do Usuwania Sierści Kłaczków Z Ubrań 2Szt;Zwierzęta > Akcesoria dla zwierząt > Akcesoria dla psów > Pielęgnacja;Zwierzęta > Akcesoria dla zwierząt > Akcesoria dla psów > Pielęgnacja;2973;Kategoria nie została zmieniona;95%;Produkt to szczotka przeznaczona do usuwania sierści zwierząt z ubrań i mebli. W drzewie kategorii OLX akcesoria służące do radzenia sobie ze skutkami posiadania zwierząt (jak usuwanie sierści) są standardowo umieszczane w sekcji Pielęgnacja w ramach Akcesoriów dla psów lub kotów. Wybrano kategorię dla psów jako najbardziej uniwersalną i zgodną z sugestią systemu.
242637107;Uchwyty Dla Dzieci Do Pisma Ręcznego 8Szt;Elektronika > Telefony > Akcesoria > Uchwyty;Dla Dzieci > Artykuły szkolne > Przybory do pisania > Pozostałe Przybory do pisania;4623;TAK;98%;Produkt to silikonowe nakładki (uchwyty) na ołówki i długopisy, które służą do korygowania postawy ręki podczas pisania. Najdokładniejszą kategorią dla tego typu akcesoriów szkolnych przeznaczonych dla dzieci jest sekcja 'Przybory do pisania', a konkretnie podkategoria 'Pozostałe Przybory do pisania'.
242637109;Golarka Do Kłaczków Zmechaceń Sierści 2Szt;Zwierzęta > Akcesoria dla zwierząt > Akcesoria dla psów > Pielęgnacja;Dom i Ogród > Wyposażenie wnętrz > Pozostałe;2112;TAK;85%;Produkt to manualny przyrząd (golarka/skrobaczka) do usuwania zmechaceń oraz kłaczków z ubrań i tekstyliów domowych (mebli, dywanów). Ze względu na brak zasilania elektrycznego nie kwalifikuje się do kategorii AGD, a jego uniwersalne zastosowanie w domu (odzież i wyposażenie) sprawia, że kategoria 'Dom i Ogród > Wyposażenie wnętrz > Pozostałe' jest najbardziej adekwatna.
242637112;Uchwyt Ścienny Wieszak Na Czapki Klucze;Dom i Ogród > Wyposażenie wnętrz > Dekoracje > Mocowania ścienne;Dom i Ogród > Wyposażenie wnętrz > Dekoracje > Mocowania ścienne;1896;Kategoria nie została zmieniona;95%;Produkt to niewielki uchwyt ścienny przeznaczony do organizacji akcesoriów (czapki, klucze). W strukturze OLX małe wieszaki ścienne i haczyki dekoracyjne są klasyfikowane w kategorii 'Mocowania ścienne' pod wyposażeniem wnętrz i dekoracjami.
242637113;Zestaw Do Czyszczenia Klawiatury I Słuchawek 7W1;Elektronika > Komputery > Akcesoria komputerowe > Klawiatury;Elektronika > Komputery > Akcesoria komputerowe > Pozostałe;2173;TAK;95%;Produkt jest wielofunkcyjnym zestawem do czyszczenia peryferiów komputerowych i elektroniki. Ze względu na brak dedykowanej kategorii dla zestawów czyszczących, najbardziej trafnym wyborem jest kategoria 'Pozostałe' w obrębie 'Akcesoriów komputerowych', ponieważ główne zastosowanie produktu to konserwacja klawiatur i innych komponentów IT.
242637114;Maska Opaska Na Oczy Do Spania Podróży 3D;Moda > Akcesoria > Pozostałe;Moda > Akcesoria > Pozostałe;2739;Kategoria nie została zmieniona;95%;Maska/opaska na oczy do spania jest traktowana na OLX jako akcesorium osobiste. Zgodnie z drzewem kategorii i standardami platformy, produkt najlepiej pasuje do ścieżki Moda > Akcesoria > Pozostałe.
242637117;Miękki Termofor Do Podgrzewania Bezzapachowy Szary;Zdrowie i Uroda > Urządzenia medyczne > Pozostałe;Zdrowie i Uroda > Urządzenia medyczne > Pozostałe;3722;Kategoria nie została zmieniona;95%;Produkt to termofor (kompres) służący do celów terapeutycznych, takich jak wygrzewanie zatok czy chłodzenie ciała. W strukturze OLX produkty o charakterze medycznym i prozdrowotnym, które nie posiadają własnej dedykowanej podkategorii (jak ciśnieniomierze czy termometry), umieszcza się w kategorii Zdrowie i Uroda > Urządzenia medyczne > Pozostałe.
242637118;Termofor Do Podgrzewania Bezzapachowy Czarny;Zdrowie i Uroda > Urządzenia medyczne > Pozostałe;Zdrowie i Uroda > Urządzenia medyczne > Pozostałe;3722;Kategoria nie została zmieniona;95%;Termofor do wygrzewania zatok i skroni jest akcesorium o charakterze zdrowotnym, służącym do termoterapii. W drzewie kategorii OLX produkty tego typu, które nie są elektroniką ani dużym sprzętem rehabilitacyjnym, najlepiej pasują do sekcji Zdrowie i Uroda > Urządzenia medyczne > Pozostałe.
