ID_Produktu;Nazwa_Produktu;Poczatkowa_Sciezka_OLX;Finalna_Sciezka_AI;Finalne_ID_AI;Czy_Zmieniono_Kategorie;Ocena_Pewnosci_AI;Uzasadnienie_AI
567398437;Torba na zakupy 14L 30x33x14 Kameleon turkus 1szt;Dla Dzieci > Zabawki > Pozostałe;Dom i Ogród > Wyposażenie wnętrz > Torby na zakupy;2144;TAK;100%;Tytuł i opis produktu jasno wskazują, że jest to torba przeznaczona do zakupów. Kategoria 'Dom i Ogród > Wyposażenie wnętrz > Przybory kuchenne > Torby na zakupy' jest idealnym i najbardziej precyzyjnym dopasowaniem.
567398461;Torba na zakupy 10L 25x15x27 Pysiaki szara 1szt;Dom i Ogród > Wyposażenie wnętrz > Torby na zakupy;Dom i Ogród > Wyposażenie wnętrz > Torby na zakupy;2144;Kategoria nie została zmieniona;100%;Tytuł i opis produktu jednoznacznie wskazują na 'Torby na zakupy' jako najlepiej dopasowaną kategorię. Produkt jest torbą przeznaczoną do pakowania zakupionych produktów i jest wielokrotnego użytku, co idealnie pasuje do definicji tej kategorii.
567398464;Torba na zakupy 10L 25x15x27 Pysiaki zielona 1szt;Dom i Ogród > Wyposażenie wnętrz > Torby na zakupy;Dom i Ogród > Wyposażenie wnętrz > Torby na zakupy;2144;Kategoria nie została zmieniona;100%;Produkt to torba na zakupy, a kategoria 'Dom i Ogród > Wyposażenie wnętrz > Torby na zakupy' jest bezpośrednio dostępna w drzewie kategorii i jest kategorią-liściem, idealnie pasującą do opisu.
567398487;Torba na zakupy 36L 45x20x40 Monstera fiolet 1szt;Dla Dzieci > Zabawki > Lalki i akcesoria > Akcesoria dla lalek;Dom i Ogród > Wyposażenie wnętrz > Torby na zakupy;2144;TAK;100%;Tytuł produktu 'Torba na zakupy' idealnie pasuje do kategorii-liścia 'Dom i Ogród > Wyposażenie wnętrz > Torby na zakupy'. Opis potwierdza przeznaczenie torby jako wielokrotnego użytku do pakowania zakupionych produktów.
567398496;Torba na zakupy 36L 45x20x40 Monstera szara 1szt;Dla Dzieci > Zabawki > Lalki i akcesoria > Akcesoria dla lalek;Dom i Ogród > Wyposażenie wnętrz > Torby na zakupy;2144;TAK;100%;Produkt to 'torba na zakupy', a kategoria 'Dom i Ogród > Wyposażenie wnętrz > Torby na zakupy' jest idealnym i bezpośrednim dopasowaniem do nazwy i przeznaczenia produktu.
567398878;Talerz kwadratowy 16x16cm 6'' pulpa trzcinowa 50sz;Antyki i Kolekcje > Antyki > Stara ceramika > Talerze;Dom i Ogród > Wyposażenie wnętrz > Zastawa stołowa > Talerze;2161;TAK;98%;Produkt jest talerzem, a kategoria 'Dom i Ogród > Wyposażenie wnętrz > Zastawa stołowa > Talerze' jest najbardziej szczegółowa i bezpośrednio odpowiada rodzajowi produktu, niezależnie od jego materiału czy jednorazowego charakteru. Kategoria z podpowiedzi 'Antyki i Kolekcje > Antyki > Stara ceramika > Talerze' jest całkowicie nieodpowiednia, ponieważ produkt jest nowoczesny i wykonany z pulpy trzcinowej, nie jest antykiem ani ceramiką.
567400047;Girlanda Świetlna Łańcuch RGB 400LED 20m Twinkly;Dom i Ogród > Oświetlenie > Girlandy świetlne;Dom i Ogród > Oświetlenie > Girlandy świetlne;3847;Kategoria nie została zmieniona;100%;Tytuł produktu 'Girlanda Świetlna' oraz opis jasno wskazują na oświetlenie typu girlanda. Kategoria 'Dom i Ogród > Oświetlenie > Girlandy świetlne' jest idealnie dopasowana i jest kategorią-liściem.
567401933;Mydło w płynie 500 ml Luksja oliwka i jogurt;Zdrowie i Uroda > Ciało > Prysznic i kąpiel > Mydła;Zdrowie i Uroda > Ciało > Prysznic i kąpiel > Mydła;3732;Kategoria nie została zmieniona;98%;Produkt jest opisany jako 'Mydło w płynie', co idealnie pasuje do kategorii 'Mydła' znajdującej się w ścieżce 'Zdrowie i Uroda > Ciało > Prysznic i kąpiel'.
567402002;Torba na zakupy 10L 25x15x27 Słonik 1szt fioletowa;Dom i Ogród > Wyposażenie wnętrz > Torby na zakupy;Dom i Ogród > Wyposażenie wnętrz > Torby na zakupy;2144;Kategoria nie została zmieniona;100%;Produkt jest jednoznacznie opisany jako 'torba na zakupy', a kategoria 'Dom i Ogród > Wyposażenie wnętrz > Torby na zakupy' (ID: 2144) jest idealnym i najbardziej precyzyjnym dopasowaniem.
567402466;Koperta 350x250mm bąbelkowa czerwona 10szt;Dla Dzieci > Artykuły szkolne > Artykuły papiernicze > Pozostałe Artykuły papiernicze;Firma i Przemysł > Biuro > Akcesoria i materiały biurowe;4655;TAK;95%;Produkt to koperta bąbelkowa, która jest klasyfikowana jako akcesorium i materiał biurowy, używany do wysyłki. Kategoria 'Firma i Przemysł > Biuro > Akcesoria i materiały biurowe' jest najbardziej adekwatna do przeznaczenia i charakteru produktu. Sugerowana kategoria 'Dla Dzieci > Artykuły szkolne > Artykuły papiernicze > Pozostałe Artykuły papiernicze' jest nieodpowiednia, ponieważ koperta bąbelkowa nie jest typowym artykułem szkolnym, a jej główna funkcja to opakowanie do wysyłki, co pasuje do ogólnych materiałów biurowych, a nie szkolnych artykułów papierniczych.
567402566;Pudełko cukiernicze z oknem 25x15x8 Hersta 50szt SUP;Dom i Ogród > Wyposażenie wnętrz > Pudełka;Firma i Przemysł > Gastronomia > Pojemniki gastronomiczne;5076;TAK;95%;Produkt to 'pudełko cukiernicze' przeznaczone do pakowania tortów, babeczek i ciast na różne uroczystości. Jest to specjalistyczny pojemnik na żywność, co najlepiej pasuje do kategorii 'Firma i Przemysł > Gastronomia > Pojemniki gastronomiczne'. Kategoria 'Dom i Ogród > Wyposażenie wnętrz > Pudełka' jest zbyt ogólna i zazwyczaj odnosi się do pudełek do przechowywania domowego, a nie opakowań spożywczych.
567402889;Sylikonowa forma do air fryer łapki frytywnica beztłuszczowa wkład;Dom i Ogród > Wyposażenie wnętrz > Przybory kuchenne > Blachy i formy do pieczenia;Dom i Ogród > Wyposażenie wnętrz > Przybory kuchenne > Blachy i formy do pieczenia;2116;Kategoria nie została zmieniona;98%;Produkt to silikonowa forma przeznaczona do użytku w frytownicy beztłuszczowej, piekarniku i innych urządzeniach do gotowania/pieczenia. Kategoria 'Blachy i formy do pieczenia' jest idealnie dopasowana, ponieważ produkt jest formą służącą do przygotowywania potraw poprzez pieczenie/obróbkę termiczną. Dołączone rękawiczki są akcesorium do głównego produktu.
567403228;Rolka termiczna 57x25 Eco bez gilzy 10szt Primus;Dla Dzieci > Artykuły szkolne > Artykuły papiernicze > Pozostałe Artykuły papiernicze;Firma i Przemysł > Sklepy i magazyny > Drukarki i akcesoria;4682;TAK;98%;Produkt to rolki termiczne przeznaczone do kas fiskalnych i terminali płatniczych, które są typowymi urządzeniami używanymi w sklepach i magazynach. Kategoria 'Firma i Przemysł > Sklepy i magazyny > Drukarki i akcesoria' jest najbardziej precyzyjna, ponieważ rolki stanowią akcesoria do tych urządzeń drukujących. Sugerowana kategoria 'Dla Dzieci' została zignorowana, gdyż jest całkowicie nietrafna.
567403238;Rolka termiczna 80x80 Eco bez gilzy 6szt;Dla Dzieci > Artykuły szkolne > Artykuły papiernicze > Pozostałe Artykuły papiernicze;Firma i Przemysł > Sklepy i magazyny > Drukarki i akcesoria;4682;TAK;98%;Produkt to rolki termiczne przeznaczone do kas fiskalnych i terminali płatniczych. Kategoria 'Firma i Przemysł > Sklepy i magazyny > Drukarki i akcesoria' jest najbardziej precyzyjna, ponieważ kasy fiskalne i terminale są urządzeniami drukującymi, a rolki stanowią ich akcesoria/materiały eksploatacyjne, używane w środowisku sklepowym/magazynowym. Sugerowana kategoria 'Dla Dzieci' jest całkowicie nieadekwatna.
567403729;Haft Diamentowy 5D Malowanie Diamentami Lisek;Dla Dzieci > Zabawki > Zabawki plastyczne;Dla Dzieci > Zabawki > Zabawki plastyczne;3084;Kategoria nie została zmieniona;95%;Produkt to zestaw do malowania diamentami, który jest formą aktywności plastycznej. Kategoria 'Zabawki plastyczne' najlepiej oddaje charakter produktu, który polega na tworzeniu obrazu za pomocą diamentów.
567403735;Haft Diamentowy 5D Malowanie Diamentami Króliczek;Dla Dzieci > Zabawki > Zabawki plastyczne;Dla Dzieci > Zabawki > Zabawki plastyczne;3084;Kategoria nie została zmieniona;95%;Produkt to zestaw do malowania diamentami, który jest formą aktywności artystycznej i twórczej. Kategoria 'Dla Dzieci > Zabawki > Zabawki plastyczne' najlepiej oddaje charakter tego produktu, koncentrując się na jego aspekcie manualnym i kreatywnym, pomimo że jest przeznaczony zarówno dla dzieci, jak i dorosłych. Opis podkreśla rozwijanie zdolności manualnych i kreatywności, co idealnie pasuje do zabawek plastycznych.
567403738;Uchwyt Modułu Fotowoltaicznego Zacisk 6szt;Brak;Dom i Ogród > Instalacje > Fotowoltaika > Pozostałe;4032;TAK;95%;Produkt to uchwyt montażowy (zacisk) do modułów fotowoltaicznych. Jest to akcesorium do instalacji fotowoltaicznych, które nie pasuje do bardziej szczegółowych kategorii takich jak falowniki, magazyny energii, panele czy zestawy. Kategoria 'Pozostałe' w gałęzi 'Fotowoltaika' jest najbardziej odpowiednia.
567403742;Szczotka do Mycia Butelek Wkład do Szczotki 4szt;Dom i Ogród > Supermarket > Środki czyszczące;Dom i Ogród > Wyposażenie wnętrz > Przybory kuchenne > Dozowniki na płyn i zmywaki;2120;TAK;95%;Produkt to szczotka do mycia butelek z wymiennymi głowicami gąbkowymi. Jest to przybór kuchenny służący do czyszczenia. Kategoria 'Dozowniki na płyn i zmywaki' (w ramach 'Przybory kuchenne') jest najbardziej odpowiednia, ponieważ 'zmywaki' to gąbki/szorowaki do naczyń, co funkcjonalnie odpowiada gąbkowej głowicy szczotki. Inne kategorie czyszczące są zbyt ogólne (np. 'Środki czyszczące' dla chemii) lub niepasujące do kontekstu kuchennego.
567403747;Torba na ramie bawełniana torba na zakupy beżowa;Moda > Torby i torebki > Torby na ramię;Moda > Torby i torebki > Shopperki;2756;TAK;98%;Produkt jest opisany jako 'torba na zakupy' o dużej pojemności, wykonana z płótna i idealna do noszenia przedmiotów podczas zakupów, co precyzyjnie odpowiada definicji kategorii 'Shopperki'.
567403750;Łyżka do Lodów Metalowa Nierdzewna;Dom i Ogród > Wyposażenie wnętrz > Przybory kuchenne > Pozostałe;Dom i Ogród > Wyposażenie wnętrz > Przybory kuchenne > Akcesoria cukiernicze;2115;TAK;90%;Produkt to gałkownica do lodów, która jest przyborem kuchennym służącym do formowania i serwowania deserów. Kategoria 'Akcesoria cukiernicze' jest najbardziej szczegółowym i semantycznie dopasowanym wyborem w gałęzi 'Przybory kuchenne', lepiej oddającym przeznaczenie produktu niż ogólna kategoria 'Pozostałe'.
567403755;Mata do Szuflady Wodoodporna 30x150 cm Szara;Dom i Ogród > Wyposażenie wnętrz > Obrusy i serwetki > Podkładki i maty;Dom i Ogród > Meble > Akcesoria meblowe;1950;TAK;95%;Produkt to mata przeznaczona do szuflad kuchennych. Szuflady są elementami mebli, a mata do nich stanowi akcesorium. Kategoria 'Akcesoria meblowe' jest najbardziej semantycznie dopasowana do funkcji i przeznaczenia produktu. Kategoria sugerowana w podpowiedzi ('Podkładki i maty' w 'Obrusy i serwetki') jest mniej precyzyjna, ponieważ sugeruje zastosowanie stołowe, a nie do szuflad.
567403759;Antypoślizgowa Mata Wkład do Szuflad 30x150cm;Dom i Ogród > Wyposażenie wnętrz > Obrusy i serwetki > Podkładki i maty;Dom i Ogród > Meble > Akcesoria meblowe;1950;TAK;95%;Produkt to antypoślizgowa mata przeznaczona do wykładania szuflad, szaf, półek i blatów. Najlepiej pasującą kategorią jest 'Akcesoria meblowe', ponieważ mata pełni funkcję akcesorium do mebli i elementów wyposażenia wnętrz, chroniąc powierzchnie i zapobiegając przesuwaniu się przedmiotów. Kategoria 'Podkładki i maty' pod 'Obrusy i serwetki' jest zbyt wąska i sugeruje zastosowanie głównie jadalniane, co nie odpowiada wszechstronnemu zastosowaniu opisanego produktu.
567403768;Formy Do Ciastek Wykrawacze Zestaw 6szt;Dom i Ogród > Wyposażenie wnętrz > Przybory kuchenne > Blachy i formy do pieczenia;Dom i Ogród > Wyposażenie wnętrz > Przybory kuchenne > Blachy i formy do pieczenia;2116;Kategoria nie została zmieniona;98%;Produkt to 'formy do ciastek' i 'wykrawacze', które są narzędziami do pieczenia. Kategoria 'Dom i Ogród > Wyposażenie wnętrz > Przybory kuchenne > Blachy i formy do pieczenia' idealnie pasuje do opisu produktu i jest kategorią-liściem.
567403778;Portfel damski z ekoskóry Portmonetka;Moda > Akcesoria > Portfele;Moda > Akcesoria > Portfele;2765;Kategoria nie została zmieniona;100%;Produkt to damski portfel, a kategoria 'Moda > Akcesoria > Portfele' jest idealnie dopasowana semantycznie i jest kategorią-liściem.
567403783;Zestaw Naklejek do malowania Diamentami 5D;Dla Dzieci > Artykuły szkolne > Artykuły plastyczne > Pozostałe Artykuły plastyczne;Dla Dzieci > Zabawki > Zabawki plastyczne;3084;TAK;95%;Produkt to zestaw do malowania diamentami, który jest aktywnością plastyczną i kreatywną przeznaczoną dla dzieci. Kategoria 'Zabawki plastyczne' najlepiej oddaje naturę produktu jako kompletną zabawkę/zestaw do twórczości artystycznej dla dzieci. Opis wyraźnie wskazuje na 'zabawę i edukację', co umieszcza go w szerokiej kategorii 'Zabawki', a konkretny typ aktywności ('malowanie diamentami') jest 'plastyczny'.
567403794;Foremki do ciastek plastikowe śnieżynki 9szt;Dom i Ogród > Wyposażenie wnętrz > Przybory kuchenne > Blachy i formy do pieczenia;Dom i Ogród > Wyposażenie wnętrz > Przybory kuchenne > Blachy i formy do pieczenia;2116;Kategoria nie została zmieniona;98%;Produkt to foremki do ciastek, które idealnie pasują do kategorii 'Blachy i formy do pieczenia' w ramach 'Przybory kuchenne', ponieważ służą do kształtowania wypieków.
567403800;Uchwyt Łazienkowy pomocniczy z Przyssawkami;Dom i Ogród > Wyposażenie wnętrz > Akcesoria łazienkowe > Zestawy akcesoriów;Dom i Ogród > Wyposażenie wnętrz > Akcesoria łazienkowe > Pozostałe;2052;TAK;95%;Produkt to pojedynczy uchwyt łazienkowy. Znajduje się w kategorii 'Dom i Ogród > Wyposażenie wnętrz > Akcesoria łazienkowe'. Ponieważ nie pasuje do żadnej bardziej szczegółowej podkategorii (np. 'Uchwyty na papier toaletowy' czy 'Zestawy akcesoriów'), najlepiej pasuje do ogólnej kategorii 'Pozostałe' w ramach akcesoriów łazienkowych.
567403823;Pudełko na tort 22x22x12cm koszyk 10szt Hersta;Dla Dzieci > Pozostałe dla dzieci;Dom i Ogród > Wyposażenie wnętrz > Przybory kuchenne > Akcesoria cukiernicze;2115;TAK;95%;Produkt to pudełko przeznaczone do transportu tortów. Torty należą do wyrobów cukierniczych, a pudełko jest akcesorium służącym do ich pakowania i przechowywania. Kategoria 'Akcesoria cukiernicze' jest najbardziej szczegółowa i najlepiej oddaje przeznaczenie produktu w kontekście kuchennym, precyzując go ponad ogólne 'Pudełka' czy 'Pojemniki i przechowywanie żywności'.
567403846;Zestaw Urodzinowy Myszka Minnie 10 szt SUP;Dom i Ogród > Wyposażenie wnętrz > Ozdoby okolicznościowe;Dom i Ogród > Wyposażenie wnętrz > Zastawa stołowa > Naczynia jednorazowe;2154;TAK;98%;Produkt to zestaw jednorazowej zastawy stołowej (talerze, kubki, serwetki) dla dzieci. Kategoria 'Naczynia jednorazowe' (Dom i Ogród > Wyposażenie wnętrz > Zastawa stołowa > Naczynia jednorazowe) jest najbardziej precyzyjnym dopasowaniem, ponieważ opis wyraźnie wskazuje na papierowe, jednorazowe elementy zastawy.
567403858;Lampa Odstraszająca Komary USB;Elektronika > Sprzęt AGD > AGD drobne > Pozostałe;Brak ID od AI;Brak;NIE;0%;Błąd parsowania odpowiedzi JSON od LLM.
567403864;Wkład Pompy Filtrującej  Intex Typ S1 2 szt.;Dom i Ogród > Narzędzia > Pompy wodne;Dom i Ogród > Ogród > Baseny;1630;TAK;95%;Produkt to wkład filtrujący przeznaczony do pomp basenowych/spa (Intex PureSpa), co bezpośrednio odnosi się do kategorii 'Baseny' w drzewie 'Dom i Ogród > Ogród'. Jest to najbardziej specyficzna dostępna kategoria dla tego typu akcesoriów basenowych.
567403876;Szczypce Kombinerki uniwersalne;Dom i Ogród > Narzędzia > Narzędzia ręczne;Dom i Ogród > Narzędzia > Narzędzia ręczne;1694;Kategoria nie została zmieniona;100%;Produkt to szczypce/kombinerki, które są klasycznym przykładem narzędzi ręcznych. Kategoria 'Dom i Ogród > Narzędzia > Narzędzia ręczne' jest najbardziej precyzyjnym i bezpośrednim dopasowaniem, a także jest kategorią-liściem.
567403880;Nóż nożyk uniwersalny z wymiennymi ostrzami różowy;Dom i Ogród > Wyposażenie wnętrz > Przybory kuchenne > Noże i nożyce kuchenne;Dom i Ogród > Narzędzia > Narzędzia ręczne;1694;TAK;95%;Produkt to uniwersalny nóż z wymiennymi ostrzami, przeznaczony do cięcia różnorodnych materiałów (lin, papieru, plastiku itp.). Jest to narzędzie ręczne, a nie kuchenne, co najlepiej pasuje do kategorii 'Dom i Ogród > Narzędzia > Narzędzia ręczne'. Sugerowana kategoria 'Noże i nożyce kuchenne' jest nieadekwatna ze względu na szerokie zastosowanie noża.
567403886;Pojemnik schowek na tabletki z dozownikiem;Dom i Ogród > Wyposażenie wnętrz > Przybory kuchenne > Pojemniki i przechowywanie żywności;Dom i Ogród > Wyposażenie wnętrz > Pudełka;2102;TAK;85%;Produkt jest przede wszystkim pojemnikiem/schowkiem, czyli rodzajem pudełka, przeznaczonym do przechowywania. Pomimo specjalistycznego zastosowania (tabletki, dozownik), najbardziej ogólna i najlepiej pasująca kategoria-liść z dostępnych to 'Pudełka' w ramach 'Wyposażenia wnętrz'. Hint dla 'Pojemniki i przechowywanie żywności' został zignorowany ze względu na semantyczne niedopasowanie ('żywności').
567403901;Pompa do butelek dozownik na wodę USB;Dom i Ogród > Narzędzia > Pompy wodne;Elektronika > Sprzęt AGD > AGD drobne > Pozostałe;2255;TAK;95%;Produkt to elektryczny dozownik wody do butelek, przeznaczony do użytku domowego lub biurowego. Najlepiej pasuje do kategorii drobnych urządzeń AGD. Ponieważ brak jest bardziej szczegółowej kategorii dla tego typu dozowników, wybieram 'Pozostałe' w ramach 'Sprzęt AGD > AGD drobne'.
567403907;Bransoletka regulowana z koralikami czarno-złoty;Moda > Biżuteria > Bransoletki;Moda > Biżuteria > Bransoletki;2834;Kategoria nie została zmieniona;100%;Tytuł produktu jednoznacznie wskazuje na 'Bransoletka', co idealnie pasuje do kategorii 'Moda > Biżuteria > Bransoletki'.
567403912;Torba TOMSHOO wodoodporna czerwona 10L sportowa;Sport i Hobby > Fitness > Akcesoria treningowe > Torby i plecaki treningowe;Sport i Hobby > Fitness > Akcesoria treningowe > Torby i plecaki treningowe;4352;Kategoria nie została zmieniona;90%;Produkt to wodoodporna torba sportowa przeznaczona do różnorodnych aktywności na świeżym powietrzu, takich jak rafting, pływanie łódką, żeglarstwo, wędkarstwo, turystyka piesza czy rowerowa. Kategoria 'Sport i Hobby > Fitness > Akcesoria treningowe > Torby i plecaki treningowe' jest najlepiej dopasowana, ponieważ torba służy do przechowywania sprzętu podczas aktywności sportowych i treningowych. Mimo że 'Fitness' może kojarzyć się głównie z siłownią, 'Akcesoria treningowe' jest wystarczająco szerokie, aby objąć sprzęt do wymienionych aktywności na świeżym powietrzu. Jest to również najbardziej szczegółowa i trafna kategoria dla tego typu produktu, unikając ogólnych kategorii 'Pozostałe' lub zbyt wąskich (np. tylko rowerowych czy wodnych).
567403931;Klej do naklejek zdobień na paznokcie 15ml;Zdrowie i Uroda > Paznokcie > Akcesoria > Pozostałe;Zdrowie i Uroda > Paznokcie > Manicure hybrydowy i żelowy > Pozostałe;3764;TAK;95%;Produkt to specjalistyczny klej do zdobień paznokci, wymagający utwardzenia w lampie UV/LED, co jest charakterystyczne dla manicure hybrydowego i żelowego. Jest to bardziej szczegółowa kategoria niż ogólne 'Akcesoria', ponieważ jego zastosowanie jest ściśle związane z konkretnym typem manicure.
567403937;Okulary przeciwsłoneczne klasyczne Pomarańczowe;Moda > Akcesoria > Okulary > Okulary przeciwsłoneczne;Moda > Akcesoria > Okulary > Okulary przeciwsłoneczne;2736;Kategoria nie została zmieniona;100%;Tytuł i opis produktu jednoznacznie wskazują, że przedmiotem sprzedaży są 'Okulary przeciwsłoneczne', co idealnie pasuje do kategorii-liścia o tej samej nazwie.
567403947;Okulary przeciwsłoneczne klasyczne Zielone;Moda > Akcesoria > Okulary > Okulary przeciwsłoneczne;Moda > Akcesoria > Okulary > Okulary przeciwsłoneczne;2736;Kategoria nie została zmieniona;100%;Tytuł i opis produktu jednoznacznie wskazują na 'okulary przeciwsłoneczne', które idealnie pasują do kategorii 'Moda > Akcesoria > Okulary > Okulary przeciwsłoneczne'.
567403952;Okulary przeciwsłoneczne klasyczne Niebieskie;Moda > Akcesoria > Okulary > Okulary przeciwsłoneczne;Moda > Akcesoria > Okulary > Okulary przeciwsłoneczne;2736;Kategoria nie została zmieniona;100%;Tytuł i opis produktu wyraźnie wskazują na 'Okulary przeciwsłoneczne'. Kategoria 'Moda > Akcesoria > Okulary > Okulary przeciwsłoneczne' (ID: 2736) jest idealnie dopasowana i jest kategorią-liściem.
567403959;Okulary przeciwsłoneczne klasyczne Brąz panterka;Moda > Akcesoria > Okulary > Okulary przeciwsłoneczne;Moda > Akcesoria > Okulary > Okulary przeciwsłoneczne;2736;Kategoria nie została zmieniona;100%;Tytuł i opis produktu wyraźnie wskazują na 'okulary przeciwsłoneczne', co idealnie pasuje do kategorii 'Moda > Akcesoria > Okulary > Okulary przeciwsłoneczne'.
567404011;Zawieszka Pop Case do AirPods Pro Brelok;Elektronika > Telefony > Akcesoria > Pozostałe;Elektronika > Sprzęt audio > Akcesoria > Pozostałe;1978;TAK;95%;"Produkt to ""Zawieszka Pop Case do AirPods Pro Brelok"". AirPods Pro to słuchawki bezprzewodowe, które są częścią kategorii 'Sprzęt audio'. Etui ochronne i brelok do słuchawek to akcesoria do sprzętu audio. Brak bardziej szczegółowej kategorii dla akcesoriów do słuchawek, więc 'Elektronika > Sprzęt audio > Akcesoria > Pozostałe' jest najbardziej odpowiednia. Kategoria 'Telefony > Akcesoria' jest mniej precyzyjna, ponieważ AirPods, choć często używane z telefonami, są przede wszystkim urządzeniem audio."
567404018;Puzzle drewniane układanka 30x20 1000szt;Dla Dzieci > Zabawki > Puzzle;Dla Dzieci > Zabawki > Puzzle;3079;Kategoria nie została zmieniona;95%;Tytuł i opis produktu jednoznacznie wskazują na 'puzzle'. Kategoria 'Dla Dzieci > Zabawki > Puzzle' jest najbardziej precyzyjną i jedyną dostępną kategorią dla tego typu produktu w dostarczonym drzewie, pomimo wzmianki o przeznaczeniu dla dorosłych, ponieważ 'Zabawki' na platformach ogłoszeniowych często obejmują szeroki zakres gier i układanek dla różnych grup wiekowych.
567404033;Krzesło do Domku Dla Lalek Fotel Mini Zabawka 1:12;Dla Dzieci > Zabawki > Lalki i akcesoria > Akcesoria dla lalek;Dla Dzieci > Zabawki > Lalki i akcesoria > Akcesoria dla lalek;3087;Kategoria nie została zmieniona;100%;Produkt to miniaturowe krzesło/fotel przeznaczone do domku dla lalek, co idealnie pasuje do kategorii 'Akcesoria dla lalek' w ramach gałęzi 'Dla Dzieci > Zabawki > Lalki i akcesoria'.
567404045;Szczotka Toaletowa Silikonowa z Pojemnikiem Zieleń;Dom i Ogród > Wyposażenie wnętrz > Akcesoria łazienkowe > Pozostałe;Dom i Ogród > Wyposażenie wnętrz > Akcesoria łazienkowe > Szczotki do WC;2062;TAK;100%;Produkt to silikonowa szczotka toaletowa z pojemnikiem. Kategoria 'Dom i Ogród > Wyposażenie wnętrz > Akcesoria łazienkowe > Szczotki do WC' jest idealnie dopasowana i jest kategorią-liściem, semantycznie najlepiej odpowiadającą opisowi produktu.
567404056;Organizer Do Szafy Na Bieliznę Przegródka 2szt;Dom i Ogród > Wyposażenie wnętrz > Pudełka;Dom i Ogród > Wyposażenie wnętrz > Pudełka;2102;Kategoria nie została zmieniona;95%;Produkt to organizer, który w opisie jest określany jako 'pudełko do przechowywania' lub 'pojemnik na ubrania'. Jego przeznaczenie to organizacja przestrzeni w szafach, szufladach czy półkach. Kategoria 'Dom i Ogród > Wyposażenie wnętrz > Pudełka' jest najbardziej adekwatna do funkcji i formy produktu, będąc kategorią-liściem i lepiej pasującą niż ogólne 'Pozostałe' czy 'Akcesoria meblowe'.
567404083;Ręcznik fryzjerski 40x70cm 40g składany 100szt;Dom i Ogród > Wyposażenie wnętrz > Ręczniki;Firma i Przemysł > Wyposażenie salonów > Akcesoria fryzjerskie > Pozostałe;5089;TAK;95%;Tytuł produktu wyraźnie wskazuje na 'Ręcznik fryzjerski'. Chociaż opis rozszerza zastosowanie do innych branż przemysłowych, kategoria 'Firma i Przemysł > Wyposażenie salonów > Akcesoria fryzjerskie' jest najbardziej precyzyjnym dopasowaniem do głównej nazwy produktu. Ponieważ nie ma podkategorii 'Ręczniki' w 'Akcesoriach fryzjerskich', wybieram 'Pozostałe' w tej gałęzi. Jest to bardziej semantycznie dopasowane niż ogólna kategoria 'Dom i Ogród > Wyposażenie wnętrz > Ręczniki', która sugeruje ręczniki do użytku domowego, a nie profesjonalnego/przemysłowego.
567404090;Ręcznik do pedicure 40x50cm 40g składany 100szt;Dom i Ogród > Wyposażenie wnętrz > Ręczniki;Firma i Przemysł > Wyposażenie salonów > Akcesoria kosmetyczne > Pozostałe;5096;TAK;95%;Tytuł produktu wyraźnie wskazuje na 'ręcznik do pedicure', co sugeruje zastosowanie profesjonalne, w salonach kosmetycznych. Opis dodatkowo podkreśla jego właściwości jako czyściwa do precyzyjnego czyszczenia w przemyśle (farmaceutycznym, spożywczym, medycznym, elektronicznym), co również pasuje do kategorii 'Firma i Przemysł'. Najbardziej szczegółową i semantycznie dopasowaną kategorią jest 'Firma i Przemysł > Wyposażenie salonów > Akcesoria kosmetyczne > Pozostałe', ponieważ ręcznik do pedicure jest akcesorium kosmetycznym, a nie ma bardziej specyficznej podkategorii dla ręczników w tym drzewie. Kategoria 'Dom i Ogród > Wyposażenie wnętrz > Ręczniki' jest zbyt ogólna i nie oddaje profesjonalnego charakteru produktu.
567404102;Podkład flizelina 60 cm 100mb 15g 1 rolka;Dla Dzieci > Artykuły szkolne > Artykuły papiernicze > Pozostałe Artykuły papiernicze;Brak ID od AI;Brak;NIE;0%;Brak odpowiedzi od AI.
