ID_Produktu;Nazwa_Produktu;Poczatkowa_Sciezka_OLX;Finalna_Sciezka_AI;Finalne_ID_AI;Czy_Zmieniono_Kategorie;Ocena_Pewnosci_AI;Uzasadnienie_AI
242636459;Wodna mata kąpielowa fontanna ogrodowa do zabawy;Dla Dzieci > Akcesoria dla niemowląt > Akcesoria do kąpieli;Dla Dzieci > Zabawki > Pozostałe;3093;TAK;92%;Produkt to ogrodowa mata wodna z funkcją fontanny/zraszacza, która służy do zabawy na zewnątrz. Ze względu na jej charakter, najlepiej pasuje do kategorii 'Dla Dzieci > Zabawki', a ponieważ w drzewie nie ma dedykowanej kategorii dla zabawek ogrodowych lub wodnych, wybór padł na najbardziej szczegółowy liść 'Pozostałe' wewnątrz sekcji zabawek.
242636460;Koperty Białe 11x23 Gr80 500szt Koperty kurierskie;Dla Dzieci > Artykuły szkolne > Artykuły papiernicze > Pozostałe Artykuły papiernicze;Firma i Przemysł > Biuro;4654;TAK;95%;Produkt to koperty wysyłkowe (kurierskie) z okienkiem w ilości hurtowej (500 sztuk), co jest typowym elementem wyposażenia i materiałów biurowych w kategorii Firma i Przemysł.
242636463;Poszewka na poduszke świąteczna 45x45 4szt;Dom i Ogród > Wyposażenie wnętrz > Pościel > Poszewki;Dom i Ogród > Wyposażenie wnętrz > Pościel > Poszewki;2041;Kategoria nie została zmieniona;100%;Produkt to zestaw czterech poszewek na poduszki (45x45 cm), co bezpośrednio odpowiada kategorii 'Poszewki' w sekcji 'Pościel' wewnątrz wyposażenia wnętrz.
242636465;Poszewka na Poduszkę Dekoracyjna 45x45cm 4szt Zień;Dom i Ogród > Wyposażenie wnętrz > Pościel > Poszewki;Dom i Ogród > Wyposażenie wnętrz > Pościel > Poszewki;2041;Kategoria nie została zmieniona;100%;Produkt to zestaw dekoracyjnych poszewek na poduszki o wymiarach 45x45 cm. W strukturze kategorii OLX najbardziej precyzyjnym miejscem dla tego typu asortymentu (tekstyliów dekoracyjnych i pościelowych) jest kategoria 'Poszewki' (ID: 2041), znajdująca się pod ścieżką Dom i Ogród > Wyposażenie wnętrz > Pościel.
242636476;Ostrzem zamienne do sekatora TABOR TOOLS GG12-1;Dom i Ogród > Ogród > Narzędzia ogrodowe > Nożyce i sekatory;Dom i Ogród > Ogród > Narzędzia ogrodowe > Nożyce i sekatory;2880;Kategoria nie została zmieniona;95%;Produkt jest ostrzem zamiennym do sekatora kowadełkowego, co czyni go częścią zamienną bezpośrednio związaną z kategorią Nożyce i sekatory w sekcji narzędzi ogrodowych.
242636479;Uchwyt na papier toaletowy ścienny stal;Dom i Ogród > Wyposażenie wnętrz > Akcesoria łazienkowe > Uchwyty na papier toaletowy;Dom i Ogród > Wyposażenie wnętrz > Akcesoria łazienkowe > Uchwyty na papier toaletowy;2063;Kategoria nie została zmieniona;100%;Produkt to uchwyt na papier toaletowy przeznaczony do montażu ściennego w łazience. W drzewie kategorii OLX istnieje dedykowana kategoria 'Uchwyty na papier toaletowy' (ID: 2063) pod Akcesoriami łazienkowymi.
242636487;Organizer na Kosmetyki Pojemnik Przezroczysty 2szt;Dom i Ogród > Wyposażenie wnętrz > Pudełka;Dom i Ogród > Wyposażenie wnętrz > Pudełka;2102;Kategoria nie została zmieniona;95%;Produkt to plastikowe pudełka/pojemniki do przechowywania i organizacji (organizer). Zgodnie z opisem i tytułem, najlepiej pasują do kategorii 'Pudełka' w dziale 'Wyposażenie wnętrz', która jest przeznaczona dla wszelkiego rodzaju pojemników do porządkowania przedmiotów w domu.
242636499;4 kółka śred. 3,2cm na płytcie obrotowej + hamulce;Dom i Ogród > Meble > Półki;Dom i Ogród > Meble > Akcesoria meblowe;1950;TAK;95%;Produkt to kółka obrotowe z hamulcem, które zgodnie z opisem służą do montażu w meblach (komody, stoły), co klasyfikuje je jako akcesoria meblowe w kategorii Dom i Ogród.
242636503;Latarka LED Mini Ładowanie USB 3 Tryby;Sport i Hobby > Turystyka > Osprzęt turystyczny > Latarki i lampy;Sport i Hobby > Turystyka > Osprzęt turystyczny > Latarki i lampy;4001;Kategoria nie została zmieniona;100%;Produkt jest przenośną latarką LED z akumulatorem USB, przeznaczoną do biwakowania, wędrówek i aktywności outdoorowych, co precyzyjnie odpowiada specyfice kategorii 'Latarki i lampy' w dziale osprzętu turystycznego.
242636506;Silikonowa miska dla niemowląt Szara;Zwierzęta > Akcesoria dla zwierząt > Akcesoria dla psów > Miski;Dla Dzieci > Akcesoria dla niemowląt > Akcesoria do karmienia;4748;TAK;100%;Produkt jest wyraźnie opisany jako miska/talerzyk dla niemowląt, wykonany z bezpiecznego silikonu spożywczego. Najbardziej precyzyjną kategorią dla tego typu artykułów dziecięcych jest 'Akcesoria do karmienia' w dziale 'Dla Dzieci'.
242636509;Pas mocujący do bagażu z podwójnym hakiem 2m 4szt;Dom i Ogród > Narzędzia > Narzędzia ręczne;Motoryzacja > Wyposażenie i akcesoria samochodowe > Pozostałe;4509;TAK;90%;Produkt to gumowy pas mocujący z hakami, przeznaczony do zabezpieczania bagażu w samochodach i motocyklach. Zgodnie z drzewem kategorii OLX, najlepiej pasuje do sekcji akcesoriów samochodowych, a konkretnie do kategorii 'Pozostałe' (ID: 4509), ponieważ nie jest to ani kompletny bagażnik (4485), ani organizer/siatka (4498), lecz uniwersalne akcesorium transportowe.
242636513;Plakaty obrazki z motywem ekspresu do kawy vintage;Antyki i Kolekcje > Kolekcje > Pozostałe;Dom i Ogród > Wyposażenie wnętrz > Dekoracje > Plakaty;1903;TAK;95%;Produkt jest zestawem nowoczesnych wydruków dekoracyjnych (plakatów) przeznaczonych do ozdoby wnętrz, co najlepiej pasuje do kategorii 'Plakaty' w dziale dekoracji wnętrz.
242636515;Pompka powietrza do materaca elektryczna 3 dysze;Sport i Hobby > Rowery > Akcesoria rowerowe > Pompki rowerowe;Sport i Hobby > Turystyka > Śpiwory, materace i karimaty > Pozostałe;3987;TAK;95%;Produkt to elektryczna pompka do materacy powietrznych. Zgodnie z drzewem kategorii OLX, najbardziej precyzyjną lokalizacją dla akcesoriów do materacy dmuchanych jest sekcja Sport i Hobby > Turystyka > Śpiwory, materace i karimaty > Pozostałe.
242636534;Dekoracja Wieczór Panieński Kubeczki 12Szt;Dom i Ogród > Wyposażenie wnętrz > Zastawa stołowa > Kubki;Dom i Ogród > Wyposażenie wnętrz > Ozdoby okolicznościowe;2111;TAK;95%;Produkt to zestaw gadżetów (kubeczki na naszyjnikach) przeznaczony specjalnie na wieczór panieński. Ze względu na charakter imprezowy i dekoracyjny, najlepiej pasuje do kategorii 'Ozdoby okolicznościowe' w dziale wyposażenia wnętrz.
242636536;Tablica Warsztatowa Narzędziowa Plastikowa czarna;Dom i Ogród > Narzędzia > Narzędzia ręczne;Dom i Ogród > Narzędzia > Pozostałe Narzędzia;1703;TAK;95%;Produkt to plastikowa ścianka (tablica) narzędziowa służąca do organizacji narzędzi w warsztacie lub garażu. Zgodnie z hierarchią OLX i przeznaczeniem konsumenckim (marka Kistenberg), produkt najlepiej pasuje do kategorii 'Dom i Ogród > Narzędzia'. Ponieważ nie jest to samo narzędzie (ręczne czy elektryczne), lecz akcesorium do ich przechowywania, wybór pada na 'Pozostałe Narzędzia'.
242636543;Uchwyt na szczoteczki do zębów naścienny 2szt;Zdrowie i Uroda > Higiena jamy ustnej > Szczoteczki;Dom i Ogród > Wyposażenie wnętrz > Akcesoria łazienkowe > Kubki i pojemniki łazienkowe;2049;TAK;95%;Produkt to uchwyt na szczoteczki do zębów będący elementem wyposażenia łazienki. Zgodnie z drzewem kategorii OLX, tego typu organizery i akcesoria łazienkowe najlepiej pasują do kategorii 'Kubki i pojemniki łazienkowe' w sekcji 'Dom i Ogród'.
242636544;"Uchwyt ścienny do telewizora 17-45"" Czarny BONTEC";Elektronika > TV > Akcesoria;Elektronika > TV > Akcesoria;1850;Kategoria nie została zmieniona;100%;Produkt to uchwyt ścienny do telewizora, który stanowi element wyposażenia dodatkowego. Zgodnie z hierarchią kategorii OLX, najbardziej odpowiednim miejscem dla tego przedmiotu jest kategoria Akcesoria w sekcji TV (Elektronika > TV > Akcesoria).
242636547;Scienny Uchwyt Na Suszarke Do Wlosow;Dom i Ogród > Wyposażenie wnętrz > Akcesoria łazienkowe > Wieszaki łazienkowe;Dom i Ogród > Wyposażenie wnętrz > Akcesoria łazienkowe > Wieszaki łazienkowe;2064;Kategoria nie została zmieniona;95%;Produkt jest ściennym akcesorium łazienkowym służącym do organizacji i zawieszania urządzeń (suszarki). W strukturze kategorii OLX, uchwyty ścienne tego typu montowane w łazience są najlepiej reprezentowane przez kategorię 'Wieszaki łazienkowe' w sekcji wyposażenia wnętrz.
242636549;Uchwyt wieszak ścienny na ręczniki samoprzylepny;Dom i Ogród > Wyposażenie wnętrz > Akcesoria łazienkowe > Wieszaki łazienkowe;Dom i Ogród > Wyposażenie wnętrz > Akcesoria łazienkowe > Wieszaki łazienkowe;2064;Kategoria nie została zmieniona;100%;Produkt to ścienny wieszak na ręczniki wykonany ze stali nierdzewnej, co idealnie pasuje do specyficznej kategorii 'Wieszaki łazienkowe' w obrębie akcesoriów łazienkowych.
242636565;Perlator przedłużacz do kranu kuchni łazienki 2szt;Brak;Dom i Ogród > Wykończenie wnętrz > Kuchnia > Baterie kuchenne;3228;TAK;95%;Produkt to perlator i przedłużacz do kranu, który jest bezpośrednim akcesorium baterii kuchennej. Opis produktu w przeważającej mierze koncentruje się na zastosowaniu w kuchni (zlewozmywaki, mycie naczyń i warzyw), dlatego kategoria 'Baterie kuchenne' jest najbardziej precyzyjnym wyborem.
242636569;Podkładka pod mysz Hearthstone 35x25cm;Elektronika > Komputery > Akcesoria komputerowe > Podkładki i stojaki;Elektronika > Komputery > Akcesoria komputerowe > Podkładki i stojaki;2170;Kategoria nie została zmieniona;100%;Produkt to podkładka pod mysz komputerową, co jednoznacznie wskazuje na kategorię liścia 'Podkładki i stojaki' znajdującą się w ścieżce Elektronika > Komputery > Akcesoria komputerowe.
242636604;Kartki Świąteczne Zestaw z Kopertami  72szt;Dla Dzieci > Artykuły szkolne > Artykuły papiernicze > Karteczki;Dom i Ogród > Wyposażenie wnętrz > Ozdoby okolicznościowe;2111;TAK;92%;Produkt to zestaw kartek z życzeniami na Boże Narodzenie, co klasyfikuje go jako artykuł okolicznościowy. Kategoria 'Ozdoby okolicznościowe' (ID: 2111) w sekcji 'Wyposażenie wnętrz' jest standardowym miejscem dla akcesoriów świątecznych na platformie OLX, w przeciwieństwie do kategorii 'Karteczki', która znajduje się w dziale artykułów szkolnych dla dzieci.
242636610;Karmnik dla Ptaków Budka Wiszący Zielona 1kg;Zwierzęta > Akcesoria dla zwierząt > Akcesoria dla ptaków > Budki;Zwierzęta > Akcesoria dla zwierząt > Akcesoria dla ptaków > Budki;2998;Kategoria nie została zmieniona;95%;Produkt jest karmnikiem dla ptaków ogrodowych, a w tytule bezpośrednio użyto określenia 'Budka'. W strukturze kategorii OLX, sekcja 'Budki' w akcesoriach dla ptaków jest właściwym miejscem zarówno dla domków lęgowych, jak i konstrukcyjnych karmników zewnętrznych.
242636615;Girlanda Ogrodowa LED Łańcuch Świetlny 9m Srebrny;Dom i Ogród > Oświetlenie > Girlandy świetlne;Dom i Ogród > Oświetlenie > Girlandy świetlne;3847;Kategoria nie została zmieniona;98%;Produkt jest wprost nazwany girlandą świetlną, a w drzewie kategorii OLX istnieje dedykowana kategoria liść 'Girlandy świetlne' w sekcji 'Oświetlenie', która jest najbardziej precyzyjnym dopasowaniem dla tego typu oświetlenia dekoracyjnego.
242636645;Plafon Lampa Sufitowa biała LED 20W Okrągła;Dom i Ogród > Oświetlenie > Lampy > Plafony;Dom i Ogród > Oświetlenie > Lampy > Plafony;3870;Kategoria nie została zmieniona;100%;Produkt jest w tytule i opisie wprost nazwany plafonem oraz lampą sufitową LED do wnętrz, co idealnie pasuje do najbardziej szczegółowej kategorii 'Plafony' w sekcji Oświetlenie.
242636646;Lampa sufitowa Led 18W Płaska Biała Yafido;Dom i Ogród > Oświetlenie > Lampy > Lampy wiszące;Dom i Ogród > Oświetlenie > Lampy > Plafony;3870;TAK;100%;Produkt to płaska lampa sufitowa LED, która w terminologii oświetleniowej określana jest jako plafon. Kategoria 'Plafony' (3870) jest najbardziej precyzyjnym dopasowaniem dla tego typu oprawy oświetleniowej montowanej bezpośrednio do sufitu.
242636673;Masażer do Stóp Mata do Masażu EMS Szara;Zdrowie i Uroda > Urządzenia do masażu;Zdrowie i Uroda > Urządzenia do masażu;3660;Kategoria nie została zmieniona;100%;Produkt to elektroniczne urządzenie przeznaczone do masażu (EMS), co w drzewie kategorii OLX jest bezpośrednio i najdokładniej opisane jako 'Urządzenia do masażu' w sekcji 'Zdrowie i Uroda'.
242636681;Haki stalowe do dużych obciążeń 4szt;Sport i Hobby > Fitness > Sprzęt siłowy > Obciążenia;Dom i Ogród > Budowa > Pozostałe;3143;TAK;90%;Produkt to stalowe elementy montażowe (haki ze stali nierdzewnej 304) przeznaczone do dużych obciążeń, wyposażone w śruby i kołki rozporowe. W drzewie kategorii OLX najbardziej odpowiednim miejscem dla drobnych akcesoriów metalowych i osprzętu montażowego o charakterze budowlanym jest kategoria 'Dom i Ogród > Budowa > Pozostałe'. Podpowiedź systemu dotycząca sprzętu siłowego jest błędna i wynika prawdopodobnie z obecności słowa 'obciążeń' w tytule.
242636692;Organizer samochodowy na krzesło torba czarna;Dla Dzieci > Akcesoria dla niemowląt > Torby, plecaki, organizery;Brak ID od AI;Brak;NIE;0%;Błąd parsowania odpowiedzi JSON od LLM.
242636724;Zeszyt A4 Notatnik Kołonotatnik Kratka 6szt STYLEX;Dla Dzieci > Artykuły szkolne > Artykuły papiernicze > Zeszyty;Dla Dzieci > Artykuły szkolne > Artykuły papiernicze > Zeszyty;4630;Kategoria nie została zmieniona;100%;Analiza produktu wykazała, że są to zeszyty typu kołonotatnik w formacie A4. Kategoria 'Zeszyty' (4630) znajdująca się w sekcji 'Dla Dzieci > Artykuły szkolne > Artykuły papiernicze' jest najbardziej specyficznym i trafnym dopasowaniem dla tego rodzaju asortymentu papierniczego.
242636733;Dozownik chloru pływający do basenów;Dom i Ogród > Wyposażenie wnętrz > Akcesoria łazienkowe > Dozowniki do mydła;Dom i Ogród > Ogród > Baseny;1630;TAK;98%;Produkt to dozownik chloru przeznaczony do basenów. W drzewie kategorii OLX akcesoria i wyposażenie basenowe znajdują się bezpośrednio w kategorii liściu 'Baseny' (ID: 1630) w sekcji 'Ogród'.
242636738;Dozowniki do chloru pływak do basenu 2 szt;Dom i Ogród > Narzędzia > Narzędzia ręczne;Dom i Ogród > Ogród > Baseny;1630;TAK;95%;Produkt to dozownik chloru przeznaczony do konserwacji basenów. W drzewie kategorii OLX najbardziej precyzyjną kategorią dla akcesoriów basenowych i środków do utrzymania czystości wody w basenie jest kategoria 'Baseny' (ID: 1630) znajdująca się w sekcji 'Ogród'.
242636740;Haczyki do Wieszaków Organizery na Ubrania;Dom i Ogród > Meble > Wieszaki;Dom i Ogród > Meble > Wieszaki;1948;Kategoria nie została zmieniona;95%;Produkt to haczyki łączące do wieszaków ubraniowych, służące do organizacji szafy. Najlepiej pasującą kategorią w strukturze OLX dla wieszaków i ich bezpośrednich akcesoriów jest kategoria 'Wieszaki' znajdująca się w sekcji 'Meble'.
242636745;Naklejka Winylowa z Włókna Węglowego 300x30cm;Antyki i Kolekcje > Kolekcje > Pozostałe;Motoryzacja > Wyposażenie i akcesoria samochodowe > Tuning wizualny;4496;TAK;95%;Produkt to folia winylowa (tzw. wrap) imitująca włókno węglowe, która jest kluczowym elementem tuningu wizualnego pojazdów, co jest głównym przeznaczeniem wymienionym w opisie.
242636749;Oświetlenie meblowe LED z czujnikiem ruchu 19cm;Dom i Ogród > Oświetlenie > Oprawy oświetleniowe;Dom i Ogród > Oświetlenie > Oprawy oświetleniowe;3850;Kategoria nie została zmieniona;95%;Produkt to gotowa oprawa oświetleniowa LED (sztywna listwa z obudową i czujnikiem), przeznaczona do montażu podszafkowego lub meblowego, co bezpośrednio odpowiada kategorii 'Oprawy oświetleniowe'.
242636760;Zestaw do Filcowania Kwiatów DIY Rękodzieło Osugin;Antyki i Kolekcje > Rękodzieło > Produkty rękodzielnicze;Dla Dzieci > Zabawki;231;TAK;95%;Produkt jest zestawem kreatywnym typu DIY (zrób to sam) przeznaczonym dla dzieci. Opis wyraźnie wskazuje na charakter zabawki edukacyjno-plastycznej, która ma rozwijać umiejętności manualne i kreatywność najmłodszych poprzez szycie i filcowanie.
242636779;Latarka Akumulatorowa LED 2 szt Kempingowa na USB;Sport i Hobby > Turystyka > Osprzęt turystyczny > Latarki i lampy;Sport i Hobby > Turystyka > Osprzęt turystyczny > Latarki i lampy;4001;Kategoria nie została zmieniona;100%;Produkt to latarka akumulatorowa opisana jako kempingowa i turystyczna, co precyzyjnie odpowiada kategorii liścia 'Latarki i lampy' w sekcji 'Osprzęt turystyczny'.
242636783;Naklejki na Ścianę 3D Kraina Lodu Elsa Frozen;Dla Dzieci > Artykuły szkolne > Artykuły papiernicze > Karteczki;Dom i Ogród > Wyposażenie wnętrz > Dekoracje > Naklejki ścienne;1897;TAK;100%;Produkt to wielkoformatowe naklejki ścienne przeznaczone do dekoracji pokoju dziecięcego, co bezpośrednio odpowiada kategorii 'Naklejki ścienne' (id: 1897) w sekcji dekoracji wnętrz.
242636785;Samoprzylepny uchyt na suszarke do włosów;Elektronika > Sprzęt AGD > AGD drobne > Suszarki do włosów;Dom i Ogród > Wyposażenie wnętrz > Akcesoria łazienkowe > Pozostałe;2052;TAK;95%;Produkt to uchwyt ścienny służący do organizacji przestrzeni w łazience. Najlepiej pasuje do kategorii 'Akcesoria łazienkowe', a ponieważ drzewo nie zawiera dedykowanej podkategorii dla uchwytów na suszarki, właściwym wyborem jest kategoria 'Pozostałe' w tej sekcji.
242636790;Piórnik Kosmetyczka na Zamek Zestaw 3 sztuki;Moda > Akcesoria > Kosmetyczki;Dla Dzieci > Artykuły szkolne > Piórniki;4604;TAK;95%;Produkt jest w tytule i opisie określony przede wszystkim jako piórnik, a wymienione zastosowania (przechowywanie długopisów, kalkulatora i cyrkla) jednoznacznie wskazują na kategorię przyborów szkolnych.
242636793;Piórnik Kosmetyczka na Zamek Zestaw 4 sztuki;Moda > Akcesoria > Kosmetyczki;Dla Dzieci > Artykuły szkolne > Piórniki;4604;TAK;90%;Tytuł produktu rozpoczyna się od słowa 'Piórnik', a opis szczegółowo wymienia przybory szkolne takie jak długopisy, kalkulator czy cyrkiel. Mimo że produkt może pełnić funkcję kosmetyczki, jego główne przeznaczenie opisane przez sprzedawcę wskazuje na kategorię artykułów szkolnych.
242636797;Plakat obrazek Motyl zestaw 3 sztuk;Dom i Ogród > Wyposażenie wnętrz > Dekoracje > Plakaty;Dom i Ogród > Wyposażenie wnętrz > Dekoracje > Plakaty;1903;Kategoria nie została zmieniona;100%;Produkt to zestaw trzech arkuszy wydruków na papierze opisanych wprost jako plakaty dekoracyjne do wnętrz, co idealnie pasuje do kategorii liścia 'Plakaty' w sekcji dekoracji wnętrz.
242636808;Torba Sportowa Podróżna na Ramię Uniseks 25L;Sport i Hobby > Fitness > Akcesoria treningowe > Torby i plecaki treningowe;Sport i Hobby > Fitness > Akcesoria treningowe > Torby i plecaki treningowe;4352;Kategoria nie została zmieniona;100%;Produkt jest wyraźnie zdefiniowany jako torba treningowa/sportowa marki Meteor, z funkcjami takimi jak osobna kieszeń na buty, co idealnie wpisuje się w kategorię torby i plecaki treningowe w sekcji Fitness.
242636811;Organizer uchwyt samoprzylepny na suszarkę do włos;Elektronika > Telefony > Akcesoria > Uchwyty;Brak ID od AI;Brak;NIE;0%;Błąd parsowania odpowiedzi JSON od LLM.
242636813;Mata silikonowa do suszenia sztućców i naczyń 2szt;Dla Dzieci > Akcesoria dla niemowląt > Akcesoria do karmienia;Dom i Ogród > Wyposażenie wnętrz > Przybory kuchenne > Ociekacze i suszarki do naczyń;2129;TAK;95%;Produkt jest matą silikonową przeznaczoną bezpośrednio do suszenia naczyń i sztućców, co najlepiej pasuje do kategorii 'Ociekacze i suszarki do naczyń' w sekcji przyborów kuchennych.
242636821;Zestaw Narzędzi Ogrodniczych Mini Miernik Gleby;Dom i Ogród > Narzędzia > Narzędzia ręczne;Dom i Ogród > Ogród > Narzędzia ogrodowe > Pozostałe;2886;TAK;95%;Produkt jest wieloelementowym zestawem narzędzi dedykowanych do pielęgnacji roślin (bonsai, sukulenty) oraz zawiera miernik parametrów gleby. Ponieważ zestaw zawiera akcesoria z różnych grup (nożyce, grabie, przyrządy pomiarowe), najlepiej pasuje do kategorii 'Pozostałe' w obrębie 'Narzędzi ogrodowych', która jest bardziej specyficzna dla ogrodnictwa niż ogólna kategoria narzędzi ręcznych.
242636826;Brama Siatka Bezpieczeństwa Dla Psów Składana;Zwierzęta > Akcesoria dla zwierząt > Akcesoria dla psów > Klatki i kojce;Zwierzęta > Akcesoria dla zwierząt > Akcesoria dla psów > Klatki i kojce;2969;Kategoria nie została zmieniona;95%;Produkt to siatkowa bramka bezpieczeństwa dla psów. W strukturze kategorii OLX akcesoria służące do ograniczania przestrzeni lub wygradzania miejsc dla psów (bramki, kojce, klatki) są klasyfikowane w kategorii 'Klatki i kojce' w sekcji akcesoriów dla psów.
242636827;Gałki Meblowe Matowe Czarne 30x22 mm 4 sztuki;Dom i Ogród > Meble > Akcesoria meblowe;Dom i Ogród > Meble > Akcesoria meblowe;1950;Kategoria nie została zmieniona;100%;Produkt to gałki meblowe (uchwyty), które są klasycznym przykładem akcesoriów meblowych. Wybrana kategoria jest najbardziej szczegółowa i idealnie dopasowana do przeznaczenia przedmiotu.
242636843;Poszewka na poduszkę 45x45 2szt Boho Zielona;Dom i Ogród > Wyposażenie wnętrz > Pościel > Poszewki;Dom i Ogród > Wyposażenie wnętrz > Pościel > Poszewki;2041;Kategoria nie została zmieniona;100%;Produkt to zestaw poszewek na poduszki (45x45 cm), co bezpośrednio odpowiada najbardziej szczegółowej kategorii 'Poszewki' w sekcji wyposażenia wnętrz.
242636851;Haft Diamentowy Dla Dzieci Naklejki;Dla Dzieci > Zabawki > Zabawki plastyczne;Dla Dzieci > Zabawki > Zabawki plastyczne;3084;Kategoria nie została zmieniona;100%;Produkt to zestaw do haftu diamentowego (naklejki DIY) przeznaczony wyraźnie dla dzieci, co klasyfikuje go jako kreatywną zabawkę plastyczną w sekcji Dla Dzieci.
242636856;Taśma dekoracyjna Washi 10 rolek + Naklejki;Dla Dzieci > Artykuły szkolne > Artykuły plastyczne > Nożyczki;Dla Dzieci > Artykuły szkolne > Artykuły plastyczne > Kleje;4613;TAK;95%;Zestaw taśm Washi i naklejek dekoracyjnych to akcesoria służące do scrapbookingu, ozdabiania pamiętników i prac DIY, co klasyfikuje je jako artykuły plastyczne. W drzewie kategorii OLX produkty te najlepiej pasują do sekcji 'Artykuły szkolne > Artykuły plastyczne', a konkretnie do kategorii 'Pozostałe', ponieważ nie posiadają dedykowanej podkategorii dla taśm czy naklejek dekoracyjnych.
242636868;Futerał Etui Ochronne Na Kontroler Ps5 Czarny;Elektronika > Telefony > Akcesoria > Etui;Elektronika > Gry i Konsole > Akcesoria gamingowe > Pozostałe;2283;TAK;95%;Produkt jest akcesorium ochronnym (etui/futerał) przeznaczonym do kontrolerów gier (PS5, Xbox). Najbardziej precyzyjną ścieżką w drzewie jest Elektronika > Gry i Konsole > Akcesoria gamingowe. Ponieważ nie istnieje liść dedykowany wyłącznie futerałom, kategoria 'Pozostałe' w obrębie akcesoriów gamingowych (ID: 2283) jest najwłaściwszym wyborem.
242636874;Włącznik Światła Biały Panel 300W Wifi;Brak;Dom i Ogród > Instalacje > Elektryka > Wtyczki, gniazda i włączniki;3210;TAK;100%;Produkt jest włącznikiem światła, który bezpośrednio odpowiada nazwie kategorii 'Wtyczki, gniazda i włączniki' w sekcji Instalacje/Elektryka.
242636877;Spinki Do Włosów metalowe złote srebrne 14szt;Moda > Akcesoria > Akcesoria do włosów > Spinki i wsuwki;Moda > Akcesoria > Akcesoria do włosów > Spinki i wsuwki;2731;Kategoria nie została zmieniona;100%;Produkt to zestaw spinek do włosów. Najdokładniejszą kategorią liściem w drzewie kategorii OLX dla tego typu asortymentu jest 'Spinki i wsuwki' znajdujące się w ścieżce Moda > Akcesoria > Akcesoria do włosów.
242636879;Głowica Prysznicowa z Wężem 1,5 M Srebrna;Brak;Dom i Ogród > Wykończenie wnętrz > Łazienka > Pozostałe;3237;TAK;95%;Słuchawka prysznicowa wraz z wężem to element armatury łazienkowej. W strukturze kategorii OLX produkty te, będące częścią instalacji natryskowej, ale nie będące kompletnymi bateriami (mieszaczami), kabinami czy wannami, najlepiej pasują do kategorii 'Dom i Ogród > Wykończenie wnętrz > Łazienka > Pozostałe'.
242636905;Forma silikonowa do lodów wielofunkcyjna;Dom i Ogród > Wyposażenie wnętrz > Przybory kuchenne > Blachy i formy do pieczenia;Dom i Ogród > Wyposażenie wnętrz > Przybory kuchenne > Blachy i formy do pieczenia;2116;Kategoria nie została zmieniona;95%;Produkt to wielofunkcyjna forma silikonowa przeznaczona do przygotowywania i przechowywania żywności (lody, czekoladki, puree). W taksonomii OLX, ze względu na brak dedykowanej kategorii dla form do mrożenia lub akcesoriów do lodów, formy silikonowe są standardowo umieszczane w kategorii 'Blachy i formy do pieczenia'.
242636909;Tornister Plecak Szkolny Dla Dziewczynki Różowy Cekinowy;Dla Dzieci > Artykuły szkolne > Plecaki szkolne;Dla Dzieci > Artykuły szkolne > Plecaki szkolne;4605;Kategoria nie została zmieniona;100%;Produkt jest plecakiem szkolnym o wymiarach 42x30 cm, co wprost odpowiada kategorii 'Plecaki szkolne' znajdującej się w sekcji artykułów szkolnych dla dzieci.
242636919;Uchwyt na szczoteczki do zębów naścienny do łazien;Zdrowie i Uroda > Higiena jamy ustnej > Szczoteczki;Dom i Ogród > Wyposażenie wnętrz > Akcesoria łazienkowe > Kubki i pojemniki łazienkowe;2049;TAK;95%;Produkt to naścienny uchwyt na szczoteczki do zębów, który stanowi element wyposażenia łazienki. W strukturze OLX uchwyty i organizery na przybory toaletowe są klasyfikowane w kategorii 'Dom i Ogród > Wyposażenie wnętrz > Akcesoria łazienkowe > Kubki i pojemniki łazienkowe'.
