ID_Produktu;Nazwa_Produktu;Poczatkowa_Sciezka_OLX;Finalna_Sciezka_AI;Finalne_ID_AI;Czy_Zmieniono_Kategorie;Ocena_Pewnosci_AI;Uzasadnienie_AI
242635228;Elektryczna Szczotka do czyszczenia Twarzy USB;Elektronika > Sprzęt AGD > AGD drobne > Pozostałe;Zdrowie i Uroda > Twarz > Pielęgnacja > Urządzenia i akcesoria;3750;TAK;98%;Produkt to elektryczne urządzenie kosmetyczne przeznaczone do czyszczenia i masażu twarzy, dlatego najlepiej pasuje do kategorii 'Urządzenia i akcesoria' w sekcji 'Pielęgnacja' dla 'Twarzy' w dziale 'Zdrowie i Uroda'.
242635246;Plecak na laptopa plecak szkolny USB 30x40cm;Moda > Torby i torebki > Plecaki;Moda > Torby i torebki > Plecaki;2755;Kategoria nie została zmieniona;95%;Produkt jest określony głównie jako plecak o szerokim zastosowaniu (miejski, szkolny, podróżny), a kategoria 'Moda > Torby i torebki > Plecaki' najlepiej definiuje ten typ przedmiotu. Chociaż posiada komorę na laptopa, forma plecaka jest dominująca nad ogólną kategorią akcesoriów komputerowych.
242635253;Podkładka na biurko ze skóry PU 80 x 40 cm;Elektronika > Komputery > Akcesoria komputerowe > Podkładki i stojaki;Elektronika > Komputery > Akcesoria komputerowe > Podkładki i stojaki;2170;Kategoria nie została zmieniona;95%;Produkt jest opisany bezpośrednio jako podkładka na biurko pełniąca funkcję podkładki pod mysz XXL i klawiaturę, co kwalifikuje go do kategorii akcesoriów komputerowych 'Podkładki i stojaki'.
242635295;Pudełka na Babeczki kolorowe 30 szt SUP;Dom i Ogród > Wyposażenie wnętrz > Pudełka;Dom i Ogród > Wyposażenie wnętrz > Przybory kuchenne > Akcesoria cukiernicze;2115;TAK;95%;Produkt to specjalistyczne opakowania przeznaczone do przechowywania i prezentacji wypieków (babeczek), co kwalifikuje go bezpośrednio do kategorii akcesoriów cukierniczych w sekcji przyborów kuchennych.
242635298;Ciśnieniomierz Cyfrowy Automatyczny na Ramie;Zdrowie i Uroda > Urządzenia medyczne > Ciśnieniomierze;Zdrowie i Uroda > Urządzenia medyczne > Ciśnieniomierze;3717;Kategoria nie została zmieniona;100%;Produkt to cyfrowy ciśnieniomierz naramienny służący do pomiaru ciśnienia tętniczego, co bezpośrednio klasyfikuje go do liścia 'Ciśnieniomierze' (ID: 3717) w gałęzi 'Urządzenia medyczne' (ID: 3661).
242635314;Lokówka falownica ceramiczna do włosów 22mm;Elektronika > Sprzęt AGD > AGD drobne > Lokówki;Elektronika > Sprzęt AGD > AGD drobne > Lokówki;2233;Kategoria nie została zmieniona;100%;Produkt to elektryczne urządzenie do stylizacji włosów (lokówka/falownica), które zgodnie z drzewem kategorii OLX znajduje się w sekcji Elektronika > Sprzęt AGD > AGD drobne > Lokówki.
242635317;Kuchenka kempingowa przenośna Mini;Sport i Hobby > Turystyka > Kuchnie i meble turystyczne > Kuchenki turystyczne;Sport i Hobby > Turystyka > Kuchnie i meble turystyczne > Kuchenki turystyczne;3993;Kategoria nie została zmieniona;100%;Produkt to lekka, kompaktowa kuchenka przeznaczona do użytku na zewnątrz (camping, turystyka), co jednoznacznie wskazuje na kategorię liścia 'Kuchenki turystyczne'.
242635426;Prostownica Do Włosów Ceramiczna Regulacja;Elektronika > Sprzęt AGD > AGD drobne > Prostownice i karbownice;Elektronika > Sprzęt AGD > AGD drobne > Prostownice i karbownice;2243;Kategoria nie została zmieniona;100%;Produkt jest urządzeniem elektrycznym służącym do prostowania włosów, co bezpośrednio odpowiada kategorii 'Prostownice i karbownice' (ID: 2243) znajdującej się w sekcji drobnego sprzętu AGD.
242635457;Elektryczny irygator do czyszczenia zębów  160ml;Elektronika > Sprzęt AGD > AGD drobne > Pozostałe;Zdrowie i Uroda > Higiena jamy ustnej > Pozostałe;3696;TAK;95%;Produkt jest urządzeniem przeznaczonym do higieny jamy ustnej. Najbardziej trafną ścieżką w drzewie kategorii jest 'Zdrowie i Uroda > Higiena jamy ustnej'. Ze względu na brak dedykowanej kategorii dla irygatorów, kategoria 'Pozostałe' (id: 3696) w tej sekcji jest najbardziej specyficznym wyborem.
242635473;Poduszka do masażu szyi i ramion przenośna 3D;Zdrowie i Uroda > Sprzęt rehabilitacyjny i ortopedyczny > Poduszki;Zdrowie i Uroda > Urządzenia do masażu;3660;TAK;100%;Produkt to elektryczna poduszka masująca (Shiatsu), która służy do aktywnego masażu różnych części ciała. Najbardziej dopasowaną kategorią liściem dla tego typu urządzeń elektronicznych służących do relaksacji i terapii jest 'Urządzenia do masażu'.
242635476;Bezprzewodowy endoskop douszny WiFi;Dom i Ogród > Narzędzia > Przyrządy miernicze;Zdrowie i Uroda > Urządzenia medyczne > Pozostałe;3722;TAK;90%;Produkt to endoskop douszny (otoskop) przeznaczony do higieny osobistej i czyszczenia uszu. Chociaż technicznie jest to kamera, jego przeznaczenie (usuwanie woskowiny, profilaktyka zdrowotna u ludzi i zwierząt) kwalifikuje go najlepiej do kategorii 'Zdrowie i Uroda > Urządzenia medyczne > Pozostałe', jako domowe urządzenie diagnostyczno-higieniczne.
242635480;Lokówka do Włosów Bezprzewodowa Automatyczna;Elektronika > Sprzęt AGD > AGD drobne > Lokówki;Elektronika > Sprzęt AGD > AGD drobne > Lokówki;2233;Kategoria nie została zmieniona;100%;Produkt to automatyczna lokówka do włosów (urządzenie elektryczne), która idealnie pasuje do kategorii 'Lokówki' znajdującej się w sekcji drobnego sprzętu AGD.
242635493;Automatyczna lokówka do włosów bezprzewodowa;Elektronika > Sprzęt AGD > AGD drobne > Lokówki;Elektronika > Sprzęt AGD > AGD drobne > Lokówki;2233;Kategoria nie została zmieniona;100%;Produkt to automatyczna lokówka elektryczna, która idealnie pasuje do dedykowanej kategorii liścia 'Lokówki' znajdującej się w sekcji AGD drobne pod kategorią Elektronika.
242635494;QL Waga kuchenna cyfrowa do 10kg;Dom i Ogród > Wyposażenie wnętrz > Przybory kuchenne > Wagi i miarki kuchenne;Dom i Ogród > Wyposażenie wnętrz > Przybory kuchenne > Wagi i miarki kuchenne;2138;Kategoria nie została zmieniona;100%;Produkt to cyfrowa waga kuchenna przeznaczona do ważenia żywności, co idealnie pasuje do kategorii 'Wagi i miarki kuchenne' znajdującej się w sekcji 'Przybory kuchenne'.
242635501;Zeszyty notatniki kolorowy zestaw 10szt tabelka;Dla Dzieci > Artykuły szkolne > Artykuły papiernicze > Zeszyty;Dla Dzieci > Artykuły szkolne > Artykuły papiernicze > Zeszyty;4630;Kategoria nie została zmieniona;100%;Produkt to zestaw zeszytów formatu A4, co precyzyjnie odpowiada kategorii liściastej 'Zeszyty' znajdującej się w sekcji 'Artykuły papiernicze' w dziale szkolnym.
242635502;Zeszyty notatniki kolorowy zestaw 10szt w Linie;Dla Dzieci > Artykuły szkolne > Artykuły papiernicze > Zeszyty;Dla Dzieci > Artykuły szkolne > Artykuły papiernicze > Zeszyty;4630;Kategoria nie została zmieniona;100%;Produkt to zestaw zeszytów w linie formatu A4, co idealnie odpowiada najbardziej szczegółowej kategorii 'Zeszyty' w drzewie kategorii OLX, znajdującej się w sekcji artykułów szkolnych i papierniczych.
242635548;Lampa powiększająca podświetlana LED;Dom i Ogród > Oświetlenie > Lampy > Lampki biurkowe;Dom i Ogród > Oświetlenie > Lampy > Lampki biurkowe;3864;Kategoria nie została zmieniona;95%;Produkt to podświetlana lampa LED z zaciskiem montażowym do blatu, co klasyfikuje ją jako lampkę biurkową. Opis podkreśla zastosowanie przy pracy i hobby przy biurku, co jest zgodne z przeznaczeniem wybranej kategorii.
242635554;Lampa LED z czujnikiem SENSELIGHT 230V;Dom i Ogród > Oświetlenie > Lampy > Lampy wiszące;Dom i Ogród > Oświetlenie > Oprawy oświetleniowe;3850;TAK;95%;Produkt to gotowa liniowa oprawa oświetleniowa LED przeznaczona do montażu pod szafkami kuchennymi lub w szufladach. Kategoria 'Oprawy oświetleniowe' (ID 3850) jest najbardziej precyzyjnym określeniem dla kompletnych opraw tego typu, w przeciwieństwie do taśm LED czy lamp wiszących.
242635560;Pokrowiec na ubrania 12szt 60 x 120/100 cm;Dom i Ogród > Wyposażenie wnętrz > Pokrowce;Dom i Ogród > Wyposażenie wnętrz > Pokrowce;2140;Kategoria nie została zmieniona;98%;Produkt to pokrowce ochronne na odzież, które służą do organizacji i ochrony ubrań w domowej garderobie. Zgodnie z drzewem kategorii OLX, najlepiej pasują do ścieżki Dom i Ogród > Wyposażenie wnętrz > Pokrowce (ID: 2140).
242635620;Maszynka do strzyżenia włosów bezprzewodowy trymer;Elektronika > Sprzęt AGD > AGD drobne > Maszynki do strzyżenia;Elektronika > Sprzęt AGD > AGD drobne > Maszynki do strzyżenia;2234;Kategoria nie została zmieniona;100%;Produkt jest elektrycznym urządzeniem do pielęgnacji osobistej (strzyżenia włosów), co kwalifikuje go bezpośrednio do kategorii drobnego sprzętu AGD. W podanym drzewie kategoria 'Maszynki do strzyżenia' (ID: 2234) jest najbardziej precyzyjnym liściem dla tego typu sprzętu.
242635669;Poszewka 45x45 cm Aksamitna Butelkowa Zieleń 4 szt;Dom i Ogród > Wyposażenie wnętrz > Pościel > Poszewki;Brak ID od AI;Brak;NIE;0%;Błąd parsowania odpowiedzi JSON od LLM.
242635672;Kurtka dla Psa Dwustronna Wodoodporna M Czarna;Zwierzęta > Akcesoria dla zwierząt > Akcesoria dla psów > Ubranka;Zwierzęta > Akcesoria dla zwierząt > Akcesoria dla psów > Ubranka;2978;Kategoria nie została zmieniona;100%;Produkt to kurtka/płaszcz przeznaczony dla psa, co jednoznacznie klasyfikuje go do kategorii ubranek dla psów w dziale akcesoriów dla zwierząt.
242635674;Etui na ?iPhone X/XS Torebka Kopertówka 15x8cm Róż;Elektronika > Telefony > Akcesoria > Etui;Elektronika > Telefony > Akcesoria > Etui;2910;Kategoria nie została zmieniona;95%;Produkt to zestaw składający się z magnetycznego etui oraz pokrowca w formie kopertówki, dedykowany dla konkretnych modeli smartfonów (iPhone X/XS). Ze względu na ścisłe dopasowanie do urządzenia, kategoria Etui w dziale Elektronika jest najbardziej odpowiednia.
242635676;Etui Na Telefon Torebka Kopertówka 15x8 cm Beż;Moda > Torby i torebki > Kopertówki;Moda > Torby i torebki > Kopertówki;2751;Kategoria nie została zmieniona;95%;Produkt jest wprost nazwany w tytule 'torebką kopertówką' i opisany jako stylowy dodatek do garderoby z łańcuszkiem na ramię. Choć pełni funkcję etui na telefon, jego forma i design pasują najlepiej do kategorii torebek typu kopertówki w dziale Moda.
242635679;Gniazdo Inteligentne Elektryczne Wifi USB Alexa;Brak;Dom i Ogród > Instalacje > Elektryka > Wtyczki, gniazda i włączniki;3210;TAK;95%;Produkt to inteligentne gniazdko elektryczne (smart plug), które najlepiej pasuje do kategorii 'Wtyczki, gniazda i włączniki' znajdującej się w sekcji Instalacje > Elektryka w dziale Dom i Ogród.
242635681;Lampa wpuszczana sufitowa LED 12W 2szt;Dom i Ogród > Oświetlenie > Lampy > Lampy wiszące;Dom i Ogród > Oświetlenie > Lampy > Oczka;3868;TAK;95%;Produkt to lampa wpuszczana (recessed), co w nomenklaturze oświetleniowej na platformach handlowych najdokładniej odpowiada kategorii 'Oczka'. Nie jest to lampa wisząca, stojąca ani plafon (montowany natynkowo).
242635688;Medisept Quatrodes Extra  1L mycie i dezynfekcja;Dom i Ogród > Supermarket > Środki czyszczące;Dom i Ogród > Supermarket > Środki czyszczące;4364;Kategoria nie została zmieniona;95%;Produkt Quatrodes Extra jest płynnym koncentratem przeznaczonym do mycia i dezynfekcji powierzchni (zarówno medycznych, jak i ogólnoużytkowych). Najlepiej pasuje do kategorii 'Środki czyszczące' w dziale Supermarket, która obejmuje detergenty i preparaty odkażające.
242635769;Menu box pojemnik dwudzielny pulpa 230x156x65mm 125 szt.;Dom i Ogród > Wyposażenie wnętrz > Przybory kuchenne > Pojemniki i przechowywanie żywności;Dom i Ogród > Wyposażenie wnętrz > Zastawa stołowa > Naczynia jednorazowe;2154;TAK;95%;Produkt to jednorazowe, biodegradowalne pojemniki cateringowe (menu boxy) wykonane z pulpy trzcinowej. Ze względu na ich jednorazowy charakter oraz przeznaczenie do serwowania posiłków, najlepiej pasują do kategorii 'Naczynia jednorazowe' w sekcji zastawy stołowej.
242635807;Masażer Oczu Elektryczny Wibracyjny Okulary;Zdrowie i Uroda > Urządzenia do masażu;Zdrowie i Uroda > Urządzenia do masażu;3660;Kategoria nie została zmieniona;100%;Produkt to elektryczne urządzenie służące do masażu okolic oczu, co bezpośrednio odpowiada definicji kategorii 'Urządzenia do masażu' w sekcji 'Zdrowie i Uroda'.
242635810;Damski portfel Skóra z ochroną RFID i breloczek;Moda > Akcesoria > Portfele;Moda > Akcesoria > Portfele;2765;Kategoria nie została zmieniona;100%;Produkt to portfel damski wykonany ze skóry, co jednoznacznie wskazuje na kategorię liścia 'Portfele' znajdującą się w ścieżce Moda > Akcesoria.
242635842;Reflektor Wpuszczany LED Sufitowy  4W 2700K 9szt;Dom i Ogród > Oświetlenie > Halogeny i naświetlacze;Dom i Ogród > Oświetlenie > Lampy > Oczka;3868;TAK;100%;Produkt to sufitowy reflektor wpuszczany (tzw. downlight), co w nomenklaturze kategorii oświetleniowych OLX jest precyzyjnie określane terminem 'Oczka'.
242635940;Taca Bambusowa na Nóżkach Stolik 51x20x33;Dom i Ogród > Wyposażenie wnętrz > Przybory kuchenne > Tace i stoliki;Dom i Ogród > Wyposażenie wnętrz > Przybory kuchenne > Tace i stoliki;2135;Kategoria nie została zmieniona;100%;Produkt to taca bambusowa z rozkładanymi nóżkami, pełniąca funkcję tacy śniadaniowej oraz stolika pomocniczego, co w drzewie kategorii OLX odpowiada liściowi 'Tace i stoliki' w sekcji Przybory kuchenne.
242635976;Kabel sieciowy LAN RJ45 Cat-7 Ethernet 4.6m biały;Elektronika > Komputery > Akcesoria komputerowe > Kable i przejściówki;Elektronika > Komputery > Akcesoria komputerowe > Kable i przejściówki;3095;Kategoria nie została zmieniona;100%;Produkt to kabel sieciowy Ethernet (LAN/RJ45), który jest standardowym akcesorium komputerowym. Najbardziej szczegółową kategorią w drzewie OLX pasującą do tego typu osprzętu jest 'Kable i przejściówki' w obrębie akcesoriów komputerowych.
242635995;Skórzane rękawice ogrodnicze długie szare rozm. L;Moda > Akcesoria > Rękawiczki;Firma i Przemysł > Odzież robocza > Rękawice;4279;TAK;90%;Wybrana kategoria (Firma i Przemysł > Odzież robocza > Rękawice) najlepiej oddaje charakter produktu. Choć rękawice są przeznaczone do ogrodu, są to rękawice ochronne (BHP) wykonane ze skóry, odporne na przebicia i chroniące przedramiona, co klasyfikuje je jako odzież roboczą. Jest to najbardziej specyficzna kategoria 'Rękawice' dla produktów niefestiwalowych i niemedycznych w drzewie kategorii.
242636349;Nylonowa żyłka do podkaszarki 2,4mm x 100m;Dom i Ogród > Narzędzia > Osprzęt do narzędzi;Dom i Ogród > Ogród > Kosiarki > Akcesoria i części;3057;TAK;98%;Produkt to żyłka do podkaszarki, będąca materiałem eksploatacyjnym (częścią) do urządzeń koszących. Najbardziej szczegółową kategorią jest 'Akcesoria i części' podrzędna do kategorii 'Kosiarki', która na OLX obejmuje również kosy spalinowe i podkaszarki.
242636357;Portfel Męski Skórzany Brązowy;Moda > Akcesoria > Portfele;Moda > Akcesoria > Portfele;2765;Kategoria nie została zmieniona;100%;Produkt jest klasycznym portfelem męskim, który idealnie pasuje do liścia 'Portfele' w ścieżce Moda > Akcesoria.
242636358;Pas grzewczy dla kobiet 3 poziomy temperatury;Zdrowie i Uroda > Sprzęt rehabilitacyjny i ortopedyczny > Pasy i gorsety;Zdrowie i Uroda > Sprzęt rehabilitacyjny i ortopedyczny > Pasy i gorsety;3703;Kategoria nie została zmieniona;95%;Produkt to pas grzewczy służący do terapii ciepłem i łagodzenia bólu (rehabilitacja/ortopedia), co najlepiej odpowiada liściowi 'Pasy i gorsety' w kategorii 'Zdrowie i Uroda'.
242636407;Lampa LED do roślin 9W 40 LED;Dom i Ogród > Oświetlenie > Lampy > Lampy wiszące;Dom i Ogród > Ogród > Pozostałe Ogród;1641;TAK;90%;Produkt to specjalistyczna lampa LED do uprawy roślin (grow light), która służy do wspomagania fotosyntezy i wzrostu roślin domowych. W drzewie kategorii OLX, przedmioty przeznaczone do pielęgnacji i uprawy roślin, które nie są narzędziami ani maszynami, najlepiej pasują do kategorii 'Dom i Ogród > Ogród > Pozostałe Ogród'.
242636431;Torba papierowa cateringowa 32x22x25cm 250szt;Dla Dzieci > Artykuły szkolne > Artykuły papiernicze > Pozostałe Artykuły papiernicze;Firma i Przemysł > Gastronomia > Pozostałe;5071;TAK;90%;Produkt to profesjonalne opakowanie transportowe przeznaczone dla branży cateringowej, o czym świadczy tytuł, opis oraz hurtowa liczba sztuk (250). W drzewie kategorii 'Firma i Przemysł > Gastronomia' (ID: 5035) brakuje dedykowanej podkategorii na opakowania jednorazowe, dlatego najbardziej odpowiednim liściem jest 'Pozostałe' (ID: 5071). Wybrana kategoria jest bardziej specyficzna dla zastosowania produktu niż ogólne artykuły papiernicze czy wyposażenie sklepów.
242636434;Ręcznik papierowy ZZ Katrin Handy Pack 20 bind;Dom i Ogród > Wyposażenie wnętrz > Ręczniki;Dom i Ogród > Supermarket > Papier toaletowy i ręczniki;4363;TAK;95%;Produkt to jednorazowy materiał eksploatacyjny (ręcznik papierowy ZZ). Kategoria 'Papier toaletowy i ręczniki' w sekcji Supermarket jest najbardziej odpowiednia dla artykułów higienicznych tego typu, w przeciwieństwie do kategorii 'Ręczniki' w wyposażeniu wnętrz, która zazwyczaj dotyczy tekstyliów domowych.
242636440;Głośnik Kraina Lodu Bluetooth Przenośny Świecący;Dla Dzieci > Zabawki > Pozostałe;Elektronika > Sprzęt audio > Głośniki i kolumny > Głośniki przenośne;1967;TAK;95%;Mimo motywu z bajki Disney 'Kraina Lodu', produkt jest w pełni funkcjonalnym urządzeniem elektronicznym (głośnik Bluetooth) z konkretną specyfikacją techniczną (akumulator Li-ion, wersja Bluetooth 4.1). Na platformie OLX głośniki przenośne, nawet te z licencjonowanym designem, najlepiej pasują do kategorii elektroniki użytkowej.
242636466;Zestaw Pościeli 220x230cm Z Microfibry Biały;Dom i Ogród > Wyposażenie wnętrz > Pościel > Komplety pościeli;Dom i Ogród > Wyposażenie wnętrz > Pościel > Komplety pościeli;2038;Kategoria nie została zmieniona;100%;Produkt to zestaw składający się z poszewki na kołdrę oraz poszewek na poduszki, co idealnie pasuje do kategorii 'Komplety pościeli' w sekcji wyposażenia wnętrz.
242636468;Poduszka Urządzenie Do Masażu Karku i Ramion Typ C;Zdrowie i Uroda > Urządzenia do masażu;Zdrowie i Uroda > Urządzenia do masażu;3660;Kategoria nie została zmieniona;95%;Produkt jest wprost nazwany urządzeniem do masażu karku i ramion oraz posiada wypustki do masażu punktowego (meridianów). Choć ma formę poduszki i służy do trakcji, jego główna funkcja opisana w tytule i przez producenta to masaż, co klasyfikuje go w kategorii 'Urządzenia do masażu' w dziale 'Zdrowie i Uroda'.
242636469;Masażer Szyi Karku Podgrzewany 6 Trybów Biały;Zdrowie i Uroda > Urządzenia do masażu;Zdrowie i Uroda > Urządzenia do masażu;3660;Kategoria nie została zmieniona;100%;Produkt jest elektronicznym urządzeniem przeznaczonym do masażu (masażer szyi i karku), co wprost odpowiada liściowi kategorii 'Urządzenia do masażu' w dziale 'Zdrowie i Uroda'.
242636471;Elektryczna szczoteczka czyszczenie i masaż twarzy;Zdrowie i Uroda > Twarz > Pielęgnacja > Urządzenia i akcesoria;Zdrowie i Uroda > Twarz > Pielęgnacja > Urządzenia i akcesoria;3750;Kategoria nie została zmieniona;100%;Produkt to elektryczne urządzenie przeznaczone do oczyszczania, złuszczania i masażu twarzy, co idealnie pasuje do najbardziej szczegółowej kategorii w ścieżce pielęgnacji twarzy: Urządzenia i akcesoria.
242636473;Haczyki samoprzylepne ze stali nierdzewnej 6szt;Dom i Ogród > Wyposażenie wnętrz > Akcesoria łazienkowe > Wieszaki łazienkowe;Dom i Ogród > Wyposażenie wnętrz > Akcesoria łazienkowe > Wieszaki łazienkowe;2064;Kategoria nie została zmieniona;95%;Produkt to haczyki ścienne (wieszaki) wykonane ze stali nierdzewnej, co jest charakterystyczne dla akcesoriów łazienkowych. W strukturze OLX kategoria 'Wieszaki łazienkowe' jest najbardziej trafnym i szczegółowym liściem dla małych haczyków montowanych na klej lub wkręty.
242636478;Uchwyt na papier toaletowy ścienny biały;Dom i Ogród > Wyposażenie wnętrz > Akcesoria łazienkowe > Uchwyty na papier toaletowy;Dom i Ogród > Wyposażenie wnętrz > Akcesoria łazienkowe > Uchwyty na papier toaletowy;2063;Kategoria nie została zmieniona;100%;Produkt to uchwyt na papier toaletowy przeznaczony do montażu w łazience, co idealnie odpowiada kategorii 'Uchwyty na papier toaletowy' (ID 2063) znajdującej się w akcesoriach łazienkowych.
242636501;Lampki solarne pochodnia 6 szt efekt płomieni LED;Antyki i Kolekcje > Antyki > Stare oświetlenie > Lampki;Dom i Ogród > Ogród > Oświetlenie ogrodowe;1638;TAK;100%;Produkt to nowoczesne lampy solarne przeznaczone do dekoracji ogrodu, ścieżek i podjazdów, co bezpośrednio odpowiada kategorii 'Oświetlenie ogrodowe' w sekcji 'Ogród'.
242636505;Mata do Akupresury Poduszka 2w1 66x42cm Zielona;Zdrowie i Uroda > Sprzęt rehabilitacyjny i ortopedyczny > Poduszki;Zdrowie i Uroda > Urządzenia do masażu;3660;TAK;95%;Produkt to zestaw do akupresury (mata i poduszka), którego główną funkcją jest masaż mechaniczny i terapia punktowa. W drzewie kategorii OLX produkty te są standardowo przypisywane do kategorii 'Urządzenia do masażu' w dziale Zdrowie i Uroda, ponieważ służą do stymulacji krążenia i rozluźniania mięśni.
242636508;Opony do hulajnogi elektrycznej Xiaomi M365 Pro;Sport i Hobby > Pojazdy elektryczne > Akcesoria do pojazdów elektrycznych;Sport i Hobby > Pojazdy elektryczne > Akcesoria do pojazdów elektrycznych;4707;Kategoria nie została zmieniona;100%;Produkt to opony przeznaczone do hulajnogi elektrycznej. W strukturze kategorii OLX, najbardziej szczegółową kategorią dla części i akcesoriów do hulajnóg elektrycznych jest 'Akcesoria do pojazdów elektrycznych' (ID: 4707) w sekcji 'Sport i Hobby'.
242636512;Pistolet spustowy do myjki ciśnieniowej Karcher;Dom i Ogród > Narzędzia > Elektronarzędzia > Pistolety;Dom i Ogród > Narzędzia > Myjki ciśnieniowe;5121;TAK;95%;Produkt jest pistoletem spustowym (osprzętem) dedykowanym wyłącznie do myjek ciśnieniowych marki Karcher. Najbardziej specyficzną i właściwą kategorią dla tego typu urządzeń oraz ich części zamiennych na platformie OLX jest kategoria 'Myjki ciśnieniowe' (5121), znajdująca się bezpośrednio w narzędziach. Kategoria 'Pistolety' (4688) w elektronarzędziach jest zazwyczaj używana dla pistoletów lakierniczych, klejowych lub opalarek.
242636530;Lampa ścienna Reflektor ścienny obrotowy GU10 2szt;Dom i Ogród > Oświetlenie > Halogeny i naświetlacze;Dom i Ogród > Oświetlenie > Lampy > Kinkiety;3863;TAK;95%;Produkt jest w tytule i opisie wprost nazwany lampą ścienną oraz kinkietem. Kategoria 'Kinkiety' (3863) jest najbardziej trafnym i szczegółowym wyborem dla oświetlenia montowanego na ścianę wewnątrz pomieszczeń.
242636539;Termometr ścienny bezdotykowy na podczerwień;Zdrowie i Uroda > Urządzenia medyczne > Termometry;Zdrowie i Uroda > Urządzenia medyczne > Termometry;3721;Kategoria nie została zmieniona;100%;Produkt to bezdotykowy termometr przeznaczony do pomiaru temperatury ciała, co w strukturze kategorii OLX odpowiada liściowi 'Termometry' w sekcji 'Urządzenia medyczne'.
242636611;Nakładka toaletowa bez pokrywy Cura Farma 26104;Elektronika > Sprzęt AGD > Części i akcesoria do AGD > Części i akcesoria do odkurzaczy;Brak ID od AI;Brak;NIE;0%;Brak odpowiedzi od AI.
242636618;Łańcuchy świetlne na baterie kulki LED Białe;Dla Dzieci > Zabawki > Pozostałe;Dom i Ogród > Oświetlenie > Girlandy świetlne;3847;TAK;100%;Produkt to dekoracyjny łańcuch świetlny (girlanda) z diodami LED, który idealnie pasuje do kategorii 'Girlandy świetlne' znajdującej się w sekcji Oświetlenie dla domu.
242636641;Lampa Sufitowa Led Biała 6 W Zestaw 5 Lamp;Dom i Ogród > Oświetlenie > Lampy > Lampy wiszące;Dom i Ogród > Oświetlenie > Lampy > Oczka;3868;TAK;95%;Produkt to zestaw ultracienkich paneli LED przeznaczonych do zabudowy w sufitach (tzw. oczka), montowanych za pomocą zacisków sprężynowych, co precyzyjnie odpowiada kategorii 'Oczka' w sekcji lamp.
242636652;Reflektor LED wpuszczany 3W 230V ciepła biel 5szt;Dom i Ogród > Oświetlenie > Halogeny i naświetlacze;Dom i Ogród > Oświetlenie > Lampy > Oczka;3868;TAK;100%;Produkt to mini reflektory LED wpuszczane, które w polskiej nomenklaturze oświetleniowej i kategoryzacji OLX są określane jako 'Oczka'.
242636654;Reflektor LED wpuszczany 3W ciepła biel 4szt;Dom i Ogród > Oświetlenie > Halogeny i naświetlacze;Dom i Ogród > Oświetlenie > Lampy > Oczka;3868;TAK;95%;Produkt to miniaturowe reflektory LED przeznaczone do montażu wpuszczanego (w otwory montażowe), co bezpośrednio odpowiada kategorii 'Oczka' w sekcji oświetlenia domowego.
242636675;Mata Dywanik  Łazienkowy 50x80cm Ciemnoszary;Dom i Ogród > Wyposażenie wnętrz > Dywany i dywaniki > Dywaniki;Dom i Ogród > Wyposażenie wnętrz > Dywany i dywaniki > Dywaniki;2095;Kategoria nie została zmieniona;95%;Produkt to bawełniany dywanik łazienkowy. W drzewie kategorii OLX, tekstylia podłogowe o niewielkich rozmiarach, takie jak maty i dywaniki łazienkowe, najlepiej pasują do kategorii 'Dywaniki' (ID: 2095) znajdującej się w sekcji 'Dywany i dywaniki'.
242636686;Pościel 200x200cm Mikrofibra 3-Częściowy Niebieski;Dom i Ogród > Wyposażenie wnętrz > Pościel > Komplety pościeli;Dom i Ogród > Wyposażenie wnętrz > Pościel > Komplety pościeli;2038;Kategoria nie została zmieniona;100%;Produkt jest opisywany jako 3-częściowy zestaw składający się z poszwy na kołdrę oraz dwóch poszewek na poduszki, co idealnie odpowiada kategorii 'Komplety pościeli'.
